Sheet: 3 курс
B1: НАЦІОНАЛЬНИЙ ТЕХНІЧНИЙ УНІВЕРСИТЕТ УКРАЇНИ "КИЇВСЬКИЙ ПОЛІТЕХНІЧНИЙ ІНСТИТУТ"
B3: РОБОЧИЙ НАВЧАЛЬНИЙ ПЛАН
X4: на 2016/ 2017 навчальний рік | AV4: інформатики та
T5: ЗАТВЕРДЖУЮ | X5: (рік набору 2014 р.) | AQ5: Факультет (інститут) | AV5: обчислювальної техніки
T6: Перший проректор НТУУ "КПІ" | W6: Напрям підготовки (код і назва) | AC6: - | AD6: 6.050103 Програмна інженерія | AQ6: Форма навчання | AV6: денна
T7: _____________________________________Ю.І.Якименко | W7: Програма професійного спрямування | AC7: - | AD7: Програмне забезпечення систем | AQ7: Термін навчання | AV7: 3 роки 10 міс.
T8: "_____"_________________ 2016 р. | W8: Освітньо-кваліфікаційний рівень | AC8: - | AD8: бакалавр | AQ8: Кваліфікація | AV8: 3121 фахівець з розробки та тестування
W9: Випускова кафедра | AC9: - | AD9: Автоматизованих систем обробки інформації та управління | AV9: програмного забезпечення
B11: № п/п | T11: Найменування дисциплін | W11: Назва кафедр | AE11: Обсяг дисципліни | AG11: Аудиторні години | AK11: Самостійна робота студентів | AL11: Контрольні заходи та їх розподіл за семестрами | AT11: Кількість годин аудиторних занять на тиждень за семестрами
AT12: 3 курс
AT13: ІП-41(25Б+1К), ІП-43 (3Б+17К)
AE14: Кредитів | AF14: Годин | AG14: Всього | AH14: в тому числі | AL14: Екзамени | AM14: Заліки | AN14: Модульн.(темат.), контр.роботи | AO14: Курсові проекти | AP14: Курсові роботи | AQ14: РГР,РР,ГР | AR14: ДКР | AS14: Реферати | AT14: 5 семестр | AX14: 6 семестр
AH15: Лекції | AI15: Практичні (семінарські) | AJ15: Лабораторні (комп'ютерний практикум) | AT15: 18 тижнів | AX15: 18 тижнів
AT16: Всього | AU16: у тому числі | AX16: Всього | AY16: у тому числі
AU17: Лекції | AV17: Практичні | AW17: Лабора-торні | AY17: Лекції | AZ17: Практичні | BA17: Лабора-торні
B18: 1 | T18: 2 | W18: 3 | AE18: 4 | AF18: 5 | AG18: 6 | AH18: 7 | AI18: 8 | AJ18: 9 | AK18: 10 | AL18: 11 | AM18: 12 | AN18: 13 | AO18: 14 | AP18: 15 | AQ18: 16 | AR18: 17 | AS18: 18 | AT18: 19 | AU18: 20 | AV18: 21 | AW18: 22 | AX18: 23 | AY18: 24 | AZ18: 25 | BA18: 26
B19: І. НОРМАТИВНІ НАВЧАЛЬНІ ДИСЦИПЛІНИ
B20: I.I. Цикл гуманітарної та соціально-економічної підготовки
B21: 1 | T21: Історія української культури | W21: Фiлософiї | AE21: =RC[1]/30 -> 2 | AF21: =SUM(RC[1]+RC[5]) -> 60 | AG21: =SUM(RC[1]:RC[3]) -> 36 | AH21: 18 | AI21: 18 | AK21: 24 | AL21: 6 | AX21: =SUM(RC[1]:RC[3]) -> 2 | AY21: 1 | AZ21: 1
B22: Разом за цикл: | AE22: =SUM(R[-1]C:R[-1]C) -> 2 | AF22: =SUM(R[-1]C:R[-1]C) -> 60 | AG22: =SUM(R[-1]C:R[-1]C) -> 36 | AH22: =SUM(R[-1]C:R[-1]C) -> 18 | AI22: =SUM(R[-1]C:R[-1]C) -> 18 | AJ22: =SUM(R[-1]C:R[-1]C) -> 0 | AK22: =SUM(R[-1]C:R[-1]C) -> 24 | AL22: =COUNT(R[-1]C:R[-1]C) -> 1 | AM22: =COUNT(R[-1]C:R[-1]C) -> 0 | AN22: =COUNT(R[-1]C:R[-1]C) -> 0 | AO22: =COUNT(R[-1]C:R[-1]C) -> 0 | AP22: =SUM(R[-1]C:R[-1]C) -> 0 | AQ22: =SUM(R[-1]C:R[-1]C) -> 0 | AR22: =SUM(R[-1]C:R[-1]C) -> 0 | AS22: =SUM(R[-1]C:R[-1]C) -> 0 | AT22: =SUM(R[-1]C:R[-1]C) -> 0 | AU22: =SUM(R[-1]C:R[-1]C) -> 0 | AV22: =SUM(R[-1]C:R[-1]C) -> 0 | AW22: =SUM(R[-1]C:R[-1]C) -> 0 | AX22: =SUM(R[-1]C:R[-1]C) -> 2 | AY22: =SUM(R[-1]C:R[-1]C) -> 1 | AZ22: =SUM(R[-1]C:R[-1]C) -> 1 | BA22: =SUM(R[-1]C:R[-1]C) -> 0
B23: I.3. Цикл професійної та практичної підготовки
B24: 2 | T24: Бази даних - 2. Програмні додатки з використанням баз даних | W24: Обчислювальної техніки | AE24: =RC[1]/30 -> 4 | AF24: =SUM(RC[1]+RC[5]) -> 120 | AG24: =SUM(RC[1]:RC[3]) -> 72 | AH24: 36 | AJ24: 36 | AK24: =RC[-4]*2/3+IF(ISBLANK(RC[1]),0,30)+IF(ISBLANK(RC[4]),0,45)+IF(ISBLANK(RC[5]),0,30) -> 48 | AM24: 5д | AN24: 5 | AT24: =SUM(RC[1]:RC[3]) -> 4 | AU24: 2 | AW24: 2
B25: 3 | T25: Бази даних - 2. Програмні додатки з використанням баз даних (курсовий проект) | W25: Обчислювальної техніки | AE25: =RC[1]/30 -> 1.5 | AF25: =SUM(RC[1]+RC[5]) -> 45 | AG25: =SUM(RC[1]:RC[3]) -> 0 | AK25: =RC[-4]*2/3+IF(ISBLANK(RC[1]),0,30)+IF(ISBLANK(RC[4]),0,45)+IF(ISBLANK(RC[5]),0,30) -> 45 | AO25: 5
B26: 4 | T26: Декларативне програмування | W26: Автоматизованих систем обробки інформації і управління | AE26: =RC[1]/30 -> 5 | AF26: =SUM(RC[1]+RC[5]) -> 150 | AG26: =SUM(RC[1]:RC[3]) -> 72 | AH26: 36 | AJ26: 36 | AK26: =RC[-4]*2/3+IF(ISBLANK(RC[1]),0,30)+IF(ISBLANK(RC[4]),0,45)+IF(ISBLANK(RC[5]),0,30) -> 78 | AL26: 6 | AN26: 6 | AX26: =SUM(RC[1]:RC[3]) -> 4 | AY26: 2 | BA26: 2
B27: 5 | T27: Конструювання програмного забезпечення | W27: Обчислювальної техніки | AE27: =RC[1]/30 -> 4 | AF27: =SUM(RC[1]+RC[5]) -> 120 | AG27: =SUM(RC[1]:RC[3]) -> 54 | AH27: 36 | AJ27: 18 | AK27: =RC[-4]*2/3+IF(ISBLANK(RC[1]),0,30)+IF(ISBLANK(RC[4]),0,45)+IF(ISBLANK(RC[5]),0,30) -> 66 | AL27: 5 | AN27: 5 | AT27: =SUM(RC[1]:RC[3]) -> 3 | AU27: 2 | AW27: 1
B28: 6 | T28: Організація комп'ютерних мереж | W28: Обчислювальної техніки | AE28: =RC[1]/30 -> 5 | AF28: =SUM(RC[1]+RC[5]) -> 150 | AG28: =SUM(RC[1]:RC[3]) -> 72 | AH28: 36 | AJ28: 36 | AK28: =RC[-4]*2/3+IF(ISBLANK(RC[1]),0,30)+IF(ISBLANK(RC[4]),0,45)+IF(ISBLANK(RC[5]),0,30) -> 78 | AL28: 6 | AN28: 6 | AX28: =SUM(RC[1]:RC[3]) -> 4 | AY28: 2 | BA28: 2
B29: 7 | T29: Економіка програмного забезпечення | W29: Теоретичної та прикладної економіки | AE29: =RC[1]/30 -> 3 | AF29: =SUM(RC[1]+RC[5]) -> 90 | AG29: =SUM(RC[1]:RC[3]) -> 54 | AH29: 36 | AI29: 18 | AK29: =RC[-4]*2/3+IF(ISBLANK(RC[1]),0,30)+IF(ISBLANK(RC[4]),0,45)+IF(ISBLANK(RC[5]),0,30) -> 36 | AM29: 6д | AN29: 6 | AX29: =SUM(RC[1]:RC[3]) -> 3 | AY29: 2 | AZ29: 1
B30: 8 | T30: Іноземна мова професійного спрямування - 1. Іноземна мова професійного спрямування | W30: Англійської мови гуманітарного спрямування № 3 | AE30: =RC[1]/30 -> 3 | AF30: =SUM(RC[1]+RC[5]) -> 90 | AG30: =SUM(RC[1]:RC[3]) -> 72 | AI30: 72 | AK30: 18 | AM30: 6 | AS30: 5 | AT30: =SUM(RC[1]:RC[3]) -> 2 | AV30: 2 | AX30: =SUM(RC[1]:RC[3]) -> 2 | AZ30: 2
B31: 9 | T31: Безпека життєдiяльностi | W31: Охорони праці, промислової та цивільної безпеки | AE31: =RC[1]/30 -> 1.5 | AF31: =SUM(RC[1]+RC[5]) -> 45 | AG31: =SUM(RC[1]:RC[3]) -> 26 | AH31: 16 | AI31: 10 | AK31: 19 | AM31: 5д | AT31: =SUM(RC[1]:RC[3]) -> 1.5 | AU31: 1 | AV31: 0.5
B32: Разом за цикл: | AE32: =SUM(R[-8]C:R[-1]C) -> 27 | AF32: =SUM(R[-8]C:R[-1]C) -> 810 | AG32: =SUM(R[-8]C:R[-1]C) -> 422 | AH32: =SUM(R[-8]C:R[-1]C) -> 196 | AI32: =SUM(R[-8]C:R[-1]C) -> 100 | AJ32: =SUM(R[-8]C:R[-1]C) -> 126 | AK32: =SUM(R[-8]C:R[-1]C) -> 388 | AL32: =COUNT(R[-8]C:R[-1]C) -> 3 | AM32: 4 | AN32: 5 | AO32: 1 | AP32: 0 | AQ32: =COUNT(R[-8]C:R[-1]C) -> 0 | AR32: =COUNT(R[-4]C:R[-1]C) -> 0 | AS32: 1 | AT32: =SUM(R[-8]C:R[-1]C) -> 10.5 | AU32: =SUM(R[-8]C:R[-1]C) -> 5 | AV32: =SUM(R[-8]C:R[-1]C) -> 2.5 | AW32: =SUM(R[-8]C:R[-1]C) -> 3 | AX32: =SUM(R[-8]C:R[-1]C) -> 13 | AY32: =SUM(R[-8]C:R[-1]C) -> 6 | AZ32: =SUM(R[-8]C:R[-1]C) -> 3 | BA32: =SUM(R[-8]C:R[-1]C) -> 4
B33: ІІ. ВИБІРКОВІ НАВЧАЛЬНІ ДИСЦИПЛІНИ
B34: ІІ.1. Дисципліни самостійного вибору навчального закладу
B35: 10 | T35: Основи економічної теорії | W35: Теоретичної та прикладної економіки | AE35: =RC[1]/30 -> 2 | AF35: =SUM(RC[1]+RC[5]) -> 60 | AG35: =SUM(RC[1]:RC[3]) -> 36 | AH35: 18 | AI35: 18 | AK35: =RC[-4]*2/3+IF(ISBLANK(RC[1]),0,30)+IF(ISBLANK(RC[4]),0,45)+IF(ISBLANK(RC[5]),0,30) -> 24 | AM35: 5 | AR35: 5 | AT35: 2 | AU35: 1 | AV35: 1
B36: 11 | T36: Програмування Інтернет | W36: Обчислювальної техніки | AE36: =RC[1]/30 -> 5 | AF36: =SUM(RC[1]+RC[5]) -> 150 | AG36: =SUM(RC[1]:RC[3]) -> 72 | AH36: 36 | AJ36: 36 | AK36: =RC[-4]*2/3+IF(ISBLANK(RC[1]),0,30)+IF(ISBLANK(RC[4]),0,45)+IF(ISBLANK(RC[5]),0,30) -> 78 | AL36: 5 | AN36: 5 | AT36: =SUM(RC[1]:RC[3]) -> 4 | AU36: 2 | AW36: 2
B37: 12 | T37: Паралельне програмування-1. Основи паралельного програмування | W37: Обчислювальної техніки | AE37: =RC[1]/30 -> 4.5 | AF37: =SUM(RC[1]+RC[5]) -> 135 | AG37: =SUM(RC[1]:RC[3]) -> 72 | AH37: 36 | AJ37: 36 | AK37: 63 | AM37: 5 | AN37: 5 | AT37: =SUM(RC[1]:RC[3]) -> 4 | AU37: 2 | AW37: 2
B38: 13 | T38: Паралельне програмування-2. Програмування для паралельних систем | W38: Обчислювальної техніки | AE38: =RC[1]/30 -> 3.5 | AF38: =RC[1]+RC[5] -> 105 | AG38: =SUM(RC[1]:RC[3]) -> 54 | AH38: 18 | AJ38: 36 | AK38: 51 | AM38: 6 | AN38: 6 | AX38: =SUM(RC[1]:RC[3]) -> 3 | AY38: 1 | BA38: 2
B39: 14 | T39: Математичні методи оптимізації | W39: Автоматизованих систем обробки інформації і управління | AE39: =RC[1]/30 -> 3 | AF39: =SUM(RC[1]+RC[5]) -> 90 | AG39: =SUM(RC[1]:RC[3]) -> 54 | AH39: 36 | AJ39: 18 | AK39: =RC[-4]*2/3+IF(ISBLANK(RC[1]),0,30)+IF(ISBLANK(RC[4]),0,45)+IF(ISBLANK(RC[5]),0,30) -> 36 | AM39: 6 | AN39: 6 | AX39: =SUM(RC[1]:RC[3]) -> 3 | AY39: 2 | BA39: 1
B40: 15 | T40: Паралельне програмування-2. Програмування для паралельних систем (курсова робота) | W40: Обчислювальної техніки | AE40: =RC[1]/30 -> 1 | AF40: =SUM(RC[1]+RC[5]) -> 30 | AG40: =SUM(RC[1]:RC[3]) -> 0 | AK40: =RC[-4]*2/3+IF(ISBLANK(RC[1]),0,30)+IF(ISBLANK(RC[4]),0,45)+IF(ISBLANK(RC[5]),0,30) -> 30 | AP40: 6
B41: Разом за цикл: | AE41: =SUM(R[-6]C:R[-1]C) -> 19 | AF41: =SUM(R[-6]C:R[-1]C) -> 570 | AG41: =SUM(R[-6]C:R[-1]C) -> 288 | AH41: =SUM(R[-6]C:R[-1]C) -> 144 | AI41: =SUM(R[-6]C:R[-1]C) -> 18 | AJ41: =SUM(R[-6]C:R[-1]C) -> 126 | AK41: =SUM(R[-6]C:R[-1]C) -> 282 | AL41: =COUNT(R[-6]C:R[-1]C) -> 1 | AM41: 4 | AN41: 4 | AO41: 0 | AP41: 1 | AQ41: =COUNT(R[-6]C:R[-1]C) -> 0 | AR41: =COUNT(R[-6]C:R[-1]C) -> 1 | AS41: =SUM(R[-6]C:R[-1]C) -> 0 | AT41: =SUM(R[-6]C:R[-1]C) -> 10 | AU41: =SUM(R[-6]C:R[-1]C) -> 5 | AV41: =SUM(R[-6]C:R[-1]C) -> 1 | AW41: =SUM(R[-6]C:R[-1]C) -> 4 | AX41: =SUM(R[-6]C:R[-1]C) -> 6 | AY41: =SUM(R[-6]C:R[-1]C) -> 3 | AZ41: =SUM(R[-6]C:R[-1]C) -> 0 | BA41: =SUM(R[-6]C:R[-1]C) -> 3
B42: ІІ.2. Дисципліни вільного вибору студентів
B43: Гуманітарна складова
B44: 16 | T44: Логіка | W44: Філософії | AE44: 2 | AF44: 60 | AG44: 36 | AH44: 36 | AK44: 24 | AM44: 5 | AT44: =SUM(RC[1]:RC[3]) -> 2 | AU44: 2
B45: 17 | T45: Правознавство | W45: Публічного права | AE45: 2 | AF45: 60 | AG45: 36 | AH45: 36 | AK45: 24 | AM45: 6 | AX45: =SUM(RC[1]:RC[3]) -> 2 | AY45: 2
B46: Разом за цикл: | AE46: =SUM(R[-2]C:R[-1]C) -> 4 | AF46: =SUM(R[-2]C:R[-1]C) -> 120 | AG46: =SUM(R[-2]C:R[-1]C) -> 72 | AH46: =SUM(R[-2]C:R[-1]C) -> 72 | AI46: =SUM(R[-2]C:R[-1]C) -> 0 | AJ46: =SUM(R[-2]C:R[-1]C) -> 0 | AK46: =SUM(R[-2]C:R[-1]C) -> 48 | AL46: 0 | AM46: 2 | AN46: 0 | AO46: 0 | AP46: 0 | AQ46: 0 | AR46: 0 | AS46: 0 | AT46: =SUM(R[-2]C:R[-1]C) -> 2 | AU46: =SUM(R[-2]C:R[-1]C) -> 2 | AV46: =SUM(R[-2]C:R[-1]C) -> 0 | AW46: =SUM(R[-2]C:R[-1]C) -> 0 | AX46: =SUM(R[-1]C:R[-1]C) -> 2 | AY46: =SUM(R[-1]C:R[-1]C) -> 2 | AZ46: =SUM(R[-1]C:R[-1]C) -> 0 | BA46: =SUM(R[-1]C:R[-1]C) -> 0
B47: Професійна складова
B48: 18 | T48: Технології програмування-1. Web-програмування на платформі NET | W48: Автоматизованих систем обробки інформації і управління | AE48: =RC[1]/30 -> 4 | AF48: =SUM(RC[1]+RC[5]) -> 120 | AG48: =SUM(RC[1]:RC[3]) -> 54 | AH48: 36 | AJ48: 18 | AK48: =RC[-4]*2/3+IF(ISBLANK(RC[1]),0,30)+IF(ISBLANK(RC[4]),0,45)+IF(ISBLANK(RC[5]),0,30) -> 66 | AL48: 5 | AN48: 5 | AT48: =SUM(RC[1]:RC[3]) -> 3 | AU48: 2 | AW48: 1
B49: 19 | T49: OLAP та сховища даних | W49: Автоматизованих систем обробки інформації і управління | AE49: =RC[1]/30 -> 4 | AF49: =RC[1]+RC[5] -> 120 | AG49: =SUM(RC[1]:RC[3]) -> 72 | AH49: 36 | AJ49: 36 | AK49: =RC[-4]*2/3+IF(ISBLANK(RC[1]),0,30)+IF(ISBLANK(RC[4]),0,45)+IF(ISBLANK(RC[5]),0,30) -> 48 | AM49: 6д | AN49: 6 | AX49: =SUM(RC[1]:RC[3]) -> 4 | AY49: 2 | BA49: 2
B50: Разом за цикл: | AE50: =SUM(R[-2]C:R[-1]C) -> 8 | AF50: =SUM(R[-2]C:R[-1]C) -> 240 | AG50: =SUM(R[-2]C:R[-1]C) -> 126 | AH50: =SUM(R[-2]C:R[-1]C) -> 72 | AI50: =SUM(R[-2]C:R[-1]C) -> 0 | AJ50: =SUM(R[-2]C:R[-1]C) -> 54 | AK50: =SUM(R[-2]C:R[-1]C) -> 114 | AL50: 1 | AM50: 1 | AN50: 2 | AO50: 0 | AP50: 0 | AQ50: 0 | AR50: 0 | AS50: 0 | AT50: =SUM(R[-1]C:R[-1]C) -> 0 | AU50: =SUM(R[-1]C:R[-1]C) -> 0 | AV50: =SUM(R[-1]C:R[-1]C) -> 0 | AW50: =SUM(R[-1]C:R[-1]C) -> 0 | AX50: =SUM(R[-1]C:R[-1]C) -> 4 | AY50: =SUM(R[-1]C:R[-1]C) -> 2 | AZ50: =SUM(R[-1]C:R[-1]C) -> 0 | BA50: =SUM(R[-1]C:R[-1]C) -> 2
T51: Всього за термін навчання: | AE51: =R[-29]C+R[-19]C+R[-10]C+R[-5]C+R[-1]C -> 60 | AF51: =R[-29]C+R[-19]C+R[-10]C+R[-5]C+R[-1]C -> 1800 | AG51: =R[-29]C+R[-19]C+R[-10]C+R[-5]C+R[-1]C -> 944 | AH51: =R[-29]C+R[-19]C+R[-10]C+R[-5]C+R[-1]C -> 502 | AI51: =R[-29]C+R[-19]C+R[-10]C+R[-5]C+R[-1]C -> 136 | AJ51: =R[-29]C+R[-19]C+R[-10]C+R[-5]C+R[-1]C -> 306 | AK51: =R[-29]C+R[-19]C+R[-10]C+R[-5]C+R[-1]C -> 856 | AL51: =R[-29]C+R[-19]C+R[-10]C+R[-5]C+R[-1]C -> 6 | AM51: =R[-29]C+R[-19]C+R[-10]C+R[-5]C+R[-1]C -> 11 | AN51: =R[-29]C+R[-19]C+R[-10]C+R[-5]C+R[-1]C -> 11 | AO51: =R[-29]C+R[-19]C+R[-10]C+R[-5]C+R[-1]C -> 1 | AP51: =R[-29]C+R[-19]C+R[-10]C+R[-5]C+R[-1]C -> 1 | AQ51: =R[-29]C+R[-19]C+R[-10]C+R[-5]C+R[-1]C -> 0 | AR51: =R[-29]C+R[-19]C+R[-10]C+R[-5]C+R[-1]C -> 1 | AS51: =R[-29]C+R[-19]C+R[-10]C+R[-5]C+R[-1]C -> 1 | AT51: =R[-29]C+R[-19]C+R[-10]C+R[-5]C+R[-1]C -> 22.5 | AU51: =R[-29]C+R[-19]C+R[-10]C+R[-5]C+R[-1]C -> 12 | AV51: =R[-29]C+R[-19]C+R[-10]C+R[-5]C+R[-1]C -> 3.5 | AW51: =R[-29]C+R[-19]C+R[-10]C+R[-5]C+R[-1]C -> 7 | AX51: =R[-29]C+R[-19]C+R[-10]C+R[-5]C+R[-1]C -> 27 | AY51: =R[-29]C+R[-19]C+R[-10]C+R[-5]C+R[-1]C -> 14 | AZ51: =R[-29]C+R[-19]C+R[-10]C+R[-5]C+R[-1]C -> 4 | BA51: =R[-29]C+R[-19]C+R[-10]C+R[-5]C+R[-1]C -> 9
AB52: Кількість | AE52: Екзаменів | AL52: 6 | AT52: 3 | AX52: 3
AE53: Заліків | AL53: 11 | AT53: 3+2д | AX53: 4+2д
AE54: Модульн. (темат.), контр. робіт | AL54: 11 | AT54: 5 | AX54: 6
T55: СКОРОЧЕННЯ: | AE55: Курсових проектів | AL55: 1 | AT55: 1
T56: РГР - розрахунково-графічна робота; | AE56: Курсових робіт | AL56: 1 | AX56: 1
T57: РР - розрахункова робота; | AE57: РГР,РР,ГР
T58: ГР - графічна робота; | AE58: ДКР | AL58: 1 | AT58: 1
T59: ДКР - домашня контрольна робота (виконується під час СРС) | AE59: Рефератів | AL59: 1 | AT59: 1
B61: ПРАКТИКИ | AB61: АТЕСТАЦІЯ ВИПУСКНИКІВ
B62: № | T62: Вид практики | V62: Термін проведення | W62: Тривалість у тижнях | Y62: Семестр | AB62: № | AC62: Форма атестації випускників | AP62: Термін проведення
T66: РОЗПОДІЛ ГОДИН ПО ПІДГОТОВЦІ ТА ЗАХИСТУ ДИПЛОМНОГО ПРОЕКТУ (РОБОТИ) РОЗПОДІЛ ГОДИН З КОМПЛЕКСНОГО ДЕРЖАВНОГО ЕКЗАМЕНУ
B68: Вид роботи | U68: Норма в годинах на 1 студента | V68: Кафедра | Y68: Кількість студентів | AA68: Всього годин | AE68: Вид роботи | AI68: Норма в годинах | AK68: К-ть дисциплін | AM68: Кафедра | AS68: Кількість груп | AU68: Кількість студентів | AW68: Всього годин
Y70: Б | Z70: К | AA70: Б | AB70: К | AS70: Б | AT70: К | AU70: Б | AV70: К | AW70: Б | AX70: К
B71: Керівництво | AE71: Консультування дисциплін, що внесені в екзамен | AI71: 2 х Г
B74: Консультування
B76: Рецензування | U76: 2 | AE76: усний екзамен | AI76: 0,5хd на 1 студ.
AE78: письмовий екзамен | AI78: 4 х d х Г+0,5 на 1 студен.
B79: ЕК | U79: 0,5 х d
T80: Всього годин | U80: 24,5* | X80: Всього годин | AA80: 0 | AB80: 0 | AT80: Всього годин
AG81: Г - кількість академічних груп бюджетних або контрактних
U82: * - 0,5 годин голові ДЕК нараховується з централізованого погодинного фонду | AG82: d - кількість членів ДЕК з даної кафедри
U83: d - кількість членів ДЕК з даної кафедри
B85: 1. | T85: Фізичне виховання | AL85: 5 - 8 семестри - у формі секційних занять
B86: 2. | T86: Військова підготовка | AE86: 22.5 | AF86: 675 | AL86: У 5 - 8 семестрах за окремим планом військової підготовки.
AG88: Ухвалено на засіданні Вченої ради факультету, ПРОТОКОЛ № 8 від 28 березня 2016 р.
V91: В.о. завідувача кафедри | AA91: / Жданова О.Г. | AD91: / | AJ91: Декан факультету (директор інституту) | AQ91: / Павлов О.А. | AV91: /
Y92: (підпис) | AB92: (П.І.Б.) | AO92: (підпис) | AS92: (П.І.Б.)

Sheet: 4 курс
B1: НАЦІОНАЛЬНИЙ ТЕХНІЧНИЙ УНІВЕРСИТЕТ УКРАЇНИ "КИЇВСЬКИЙ ПОЛІТЕХНІЧНИЙ ІНСТИТУТ"
B3: РОБОЧИЙ НАВЧАЛЬНИЙ ПЛАН
X4: на 2016/ 2017 навчальний рік | AV4: інформатики та
T5: ЗАТВЕРДЖУЮ | X5: (рік набору 2013 р.) | AQ5: Факультет (інститут) | AV5: обчислювальної техніки
T6: Перший проректор НТУУ "КПІ" | W6: Напрям підготовки (код і назва) | AC6: - | AD6: 6.050103 Програмна інженерія | AQ6: Форма навчання | AV6: денна
T7: _____________________________________Ю.І.Якименко | W7: Програма професійного спрямування | AC7: - | AD7: Програмне забезпечення систем | AQ7: Термін навчання | AV7: 3 роки 10 міс.
T8: "_____"_________________ 2016 р. | W8: Освітньо-кваліфікаційний рівень | AC8: - | AD8: бакалавр | AQ8: Кваліфікація | AV8: 3121 фахівець з розробки та тестування
W9: Випускова кафедра | AC9: - | AD9: Автоматизованих систем обробки інформації та управління | AV9: програмного забезпечення
B11: № п/п | T11: Найменування дисциплін | W11: Назва кафедр | AE11: Обсяг дисципліни | AG11: Аудиторні години | AK11: Самостійна робота студентів | AL11: Контрольні заходи та їх розподіл за семестрами | AT11: Кількість годин аудиторних занять на тиждень за семестрами
AT12: 4 курс
AT13: ІП-31(22Б+11К)
AE14: Кредитів | AF14: Годин | AG14: Всього | AH14: в тому числі | AL14: Екзамени | AM14: Заліки | AN14: Модульн.(темат.), контр.роботи | AO14: Курсові проекти | AP14: Курсові роботи | AQ14: РГР,РР,ГР | AR14: ДКР | AS14: Реферати | AT14: 7 семестр | AX14: 8 семестр
AH15: Лекції | AI15: Практичні (семінарські) | AJ15: Лабораторні (комп'ютерний практикум) | AT15: 18 тижнів | AX15: 9 тижнів
AT16: Всього | AU16: у тому числі | AX16: Всього | AY16: у тому числі
AU17: Лекції | AV17: Практичні | AW17: Лабора-торні | AY17: Лекції | AZ17: Практичні | BA17: Лабора-торні
B18: 1 | T18: 2 | W18: 3 | AE18: 4 | AF18: 5 | AG18: 6 | AH18: 7 | AI18: 8 | AJ18: 9 | AK18: 10 | AL18: 11 | AM18: 12 | AN18: 13 | AO18: 14 | AP18: 15 | AQ18: 16 | AR18: 17 | AS18: 18 | AT18: 19 | AU18: 20 | AV18: 21 | AW18: 22 | AX18: 23 | AY18: 24 | AZ18: 25 | BA18: 26
B19: І. НОРМАТИВНІ НАВЧАЛЬНІ ДИСЦИПЛІНИ
B20: I.I. Цикл гуманітарної та соціально-економічної підготовки
B21: 1 | T21: Політологія | W21: Соціології | AE21: =RC[1]/30 -> 2 | AF21: =SUM(RC[1]+RC[5]) -> 60 | AG21: =SUM(RC[1]:RC[3]) -> 36 | AH21: 18 | AI21: 18 | AK21: 24 | AL21: 7 | AT21: =SUM(RC[1]:RC[3]) -> 2 | AU21: 1 | AV21: 1
B22: Разом за цикл: | AE22: =SUM(R[-1]C:R[-1]C) -> 2 | AF22: =SUM(R[-1]C:R[-1]C) -> 60 | AG22: =SUM(R[-1]C:R[-1]C) -> 36 | AH22: =SUM(R[-1]C:R[-1]C) -> 18 | AI22: =SUM(R[-1]C:R[-1]C) -> 18 | AJ22: =SUM(R[-1]C:R[-1]C) -> 0 | AK22: =SUM(R[-1]C:R[-1]C) -> 24 | AL22: =COUNT(R[-1]C:R[-1]C) -> 1 | AM22: =COUNT(R[-1]C:R[-1]C) -> 0 | AN22: =COUNT(R[-1]C:R[-1]C) -> 0 | AO22: =COUNT(R[-1]C:R[-1]C) -> 0 | AP22: =COUNT(R[-1]C:R[-1]C) -> 0 | AQ22: =COUNT(R[-1]C:R[-1]C) -> 0 | AR22: =COUNT(R[-1]C:R[-1]C) -> 0 | AS22: =COUNT(R[-1]C:R[-1]C) -> 0 | AT22: =SUM(R[-1]C:R[-1]C) -> 2 | AU22: =SUM(R[-1]C:R[-1]C) -> 1 | AV22: =SUM(R[-1]C:R[-1]C) -> 1 | AW22: =SUM(R[-1]C:R[-1]C) -> 0 | AX22: =SUM(R[-1]C:R[-1]C) -> 0 | AY22: =SUM(R[-1]C:R[-1]C) -> 0 | AZ22: =SUM(R[-1]C:R[-1]C) -> 0 | BA22: =SUM(R[-1]C:R[-1]C) -> 0
B23: I.3. Цикл професійної та практичної підготовки
B24: 2 | T24: Якість програмного забезпечення та тестування | W24: Автоматизованих систем обробки інформації і управління | AE24: =RC[1]/30 -> 4 | AF24: =SUM(RC[1]+RC[5]) -> 120 | AG24: =SUM(RC[1]:RC[3]) -> 72 | AH24: 36 | AJ24: 36 | AK24: =RC[-4]*2/3+IF(ISBLANK(RC[1]),0,30)+IF(ISBLANK(RC[4]),0,45)+IF(ISBLANK(RC[5]),0,30) -> 48 | AM24: 7д | AN24: 7 | AT24: =SUM(RC[1]:RC[3]) -> 4 | AU24: 2 | AW24: 2
B25: 3 | T25: Безпека програм та даних | W25: Обчислювальної техніки | AE25: =RC[1]/30 -> 4 | AF25: =SUM(RC[1]+RC[5]) -> 120 | AG25: =SUM(RC[1]:RC[3]) -> 54 | AH25: 36 | AJ25: 18 | AK25: =RC[-4]*2/3+IF(ISBLANK(RC[1]),0,30)+IF(ISBLANK(RC[4]),0,45)+IF(ISBLANK(RC[5]),0,30) -> 66 | AL25: 7 | AN25: 7 | AT25: =SUM(RC[1]:RC[3]) -> 3 | AU25: 2 | AW25: 1
B26: 4 | T26: Програмування Інтернет | W26: Обчислювальної техніки | AE26: =RC[1]/30 -> 4 | AF26: =SUM(RC[1]+RC[5]) -> 120 | AG26: =SUM(RC[1]:RC[3]) -> 72 | AH26: 36 | AJ26: 36 | AK26: =RC[-4]*2/3+IF(ISBLANK(RC[1]),0,30)+IF(ISBLANK(RC[4]),0,45)+IF(ISBLANK(RC[5]),0,30) -> 48 | AM26: 7д | AN26: 7 | AT26: =SUM(RC[1]:RC[3]) -> 4 | AU26: 2 | AW26: 2
B27: 5 | T27: Розподілені системи та паралельні обчислення | W27: Автоматизованих систем обробки інформації і управління | AE27: =RC[1]/30 -> 4 | AF27: =SUM(RC[1]+RC[5]) -> 120 | AG27: =SUM(RC[1]:RC[3]) -> 72 | AH27: 36 | AJ27: 36 | AK27: =RC[-4]*2/3+IF(ISBLANK(RC[1]),0,30)+IF(ISBLANK(RC[4]),0,45)+IF(ISBLANK(RC[5]),0,30) -> 48 | AM27: 8д | AN27: 8 | AX27: =SUM(RC[1]:RC[3]) -> 8 | AY27: 4 | BA27: 4
B28: 6 | T28: Проектний практикум | W28: Автоматизованих систем обробки інформації і управління | AE28: =RC[1]/30 -> 3 | AF28: =SUM(RC[1]+RC[5]) -> 90 | AG28: =SUM(RC[1]:RC[3]) -> 54 | AH28: 18 | AJ28: 36 | AK28: =RC[-4]*2/3+IF(ISBLANK(RC[1]),0,30)+IF(ISBLANK(RC[4]),0,45)+IF(ISBLANK(RC[5]),0,30) -> 36 | AM28: 8 | AN28: 8 | AX28: =SUM(RC[1]:RC[3]) -> 6 | AY28: 2 | BA28: 4
B29: 7 | T29: Основи охорони праці | W29: Охорони праці, промислової та цивільної безпеки | AE29: =RC[1]/30 -> 1.5 | AF29: =SUM(RC[1]+RC[5]) -> 45 | AG29: =SUM(RC[1]:RC[3]) -> 18 | AH29: 10 | AI29: 8 | AK29: 27 | AL29: 8 | AX29: =SUM(RC[1]:RC[3]) -> 2 | AY29: 1 | AZ29: 1
B30: 8 | T30: Переддипломна практика | W30: Автоматизованих систем обробки інформації і управління | AE30: =RC[1]/30 -> 6 | AF30: =SUM(RC[1]+RC[5]) -> 180 | AG30: =SUM(RC[1]:RC[3]) -> 0 | AK30: 180 | AM30: 8д | AX30: х
B31: 9 | T31: Дипломне проектування | W31: Автоматизованих систем обробки інформації і управління | AE31: =RC[1]/30 -> 9 | AF31: =SUM(RC[1]+RC[5]) -> 270 | AG31: =SUM(RC[1]:RC[3]) -> 0 | AK31: 270 | AX31: х
B32: Разом за цикл: | AE32: =SUM(R[-8]C:R[-1]C) -> 35.5 | AF32: =SUM(R[-8]C:R[-1]C) -> 1065 | AG32: =SUM(R[-8]C:R[-1]C) -> 342 | AH32: =SUM(R[-8]C:R[-1]C) -> 172 | AI32: =SUM(R[-8]C:R[-1]C) -> 8 | AJ32: =SUM(R[-8]C:R[-1]C) -> 162 | AK32: =SUM(R[-8]C:R[-1]C) -> 723 | AL32: =COUNT(R[-8]C:R[-1]C) -> 2 | AM32: 5 | AN32: 5 | AO32: 0 | AP32: 0 | AQ32: =COUNT(R[-8]C:R[-1]C) -> 0 | AR32: =COUNT(#REF!) -> 0 | AS32: 0 | AT32: =SUM(R[-8]C:R[-1]C) -> 11 | AU32: =SUM(R[-8]C:R[-1]C) -> 6 | AV32: =SUM(R[-8]C:R[-1]C) -> 0 | AW32: =SUM(R[-8]C:R[-1]C) -> 5 | AX32: =SUM(R[-8]C:R[-1]C) -> 16 | AY32: =SUM(R[-8]C:R[-1]C) -> 7 | AZ32: =SUM(R[-8]C:R[-1]C) -> 1 | BA32: =SUM(R[-8]C:R[-1]C) -> 8
B33: ІІ. ВИБІРКОВІ НАВЧАЛЬНІ ДИСЦИПЛІНИ
B34: ІІ.1. Дисципліни самостійного вибору навчального закладу
B35: 10 | T35: Іноземна мова професійного спрямування - 2. Іноземна мова для професійно-орієнтованого спілкування. Ділове мовлення. | W35: Англійської мови гуманітарного спрямування № 3 | AE35: =RC[1]/30 -> 1.5 | AF35: =SUM(RC[1]+RC[5]) -> 45 | AG35: =SUM(RC[1]:RC[3]) -> 36 | AI35: 36 | AK35: 9 | AM35: 7 | AT35: =SUM(RC[1]:RC[3]) -> 2 | AV35: 2
B36: 11 | T36: Моделювання систем | W36: Автоматизованих систем обробки інформації і управління | AE36: =RC[1]/30 -> 5 | AF36: =SUM(RC[1]+RC[5]) -> 150 | AG36: =SUM(RC[1]:RC[3]) -> 72 | AH36: 36 | AJ36: 36 | AK36: =RC[-4]*2/3+IF(ISBLANK(RC[1]),0,30)+IF(ISBLANK(RC[4]),0,45)+IF(ISBLANK(RC[5]),0,30) -> 78 | AL36: 7 | AN36: 7 | AT36: =SUM(RC[1]:RC[3]) -> 4 | AU36: 2 | AW36: 2
B37: 12 | T37: Системи автоматизації процесів проектування | W37: Обчислювальної техніки | AE37: =RC[1]/30 -> 2 | AF37: =SUM(RC[1]+RC[5]) -> 60 | AG37: =SUM(RC[1]:RC[3]) -> 36 | AH37: 18 | AJ37: 18 | AK37: =RC[-4]*2/3+IF(ISBLANK(RC[1]),0,30)+IF(ISBLANK(RC[4]),0,45)+IF(ISBLANK(RC[5]),0,30) -> 24 | AM37: 8 | AN37: 8 | AX37: =SUM(RC[1]:RC[3]) -> 4 | AY37: 2 | BA37: 2
B38: 13 | T38: Графічне та геометричне моделювання | W38: Обчислювальної техніки | AE38: =RC[1]/30 -> 4 | AF38: =SUM(RC[1]+RC[5]) -> 120 | AG38: =SUM(RC[1]:RC[3]) -> 72 | AH38: 36 | AJ38: 36 | AK38: =RC[-4]*2/3+IF(ISBLANK(RC[1]),0,30)+IF(ISBLANK(RC[4]),0,45)+IF(ISBLANK(RC[5]),0,30) -> 48 | AM38: 7 | AN38: 7 | AT38: =SUM(RC[1]:RC[3]) -> 4 | AU38: 2 | AW38: 2
B39: 14 | T39: Графічне та геометричне моделювання (курсовий проект) | W39: Обчислювальної техніки | AE39: =RC[1]/30 -> 1.5 | AF39: =SUM(RC[1]+RC[5]) -> 45 | AG39: =SUM(RC[1]:RC[3]) -> 0 | AK39: =RC[-4]*2/3+IF(ISBLANK(RC[1]),0,30)+IF(ISBLANK(RC[4]),0,45)+IF(ISBLANK(RC[5]),0,30) -> 45 | AO39: 7
B40: Разом за цикл: | AE40: =SUM(R[-5]C:R[-1]C) -> 14 | AF40: =SUM(R[-5]C:R[-1]C) -> 420 | AG40: =SUM(R[-5]C:R[-1]C) -> 216 | AH40: =SUM(R[-5]C:R[-1]C) -> 90 | AI40: =SUM(R[-5]C:R[-1]C) -> 36 | AJ40: =SUM(R[-5]C:R[-1]C) -> 90 | AK40: =SUM(R[-5]C:R[-1]C) -> 204 | AL40: =COUNT(R[-5]C:R[-1]C) -> 1 | AM40: 3 | AN40: 3 | AO40: 1 | AP40: 0 | AQ40: =COUNT(R[-5]C:R[-1]C) -> 0 | AR40: =COUNT(R[-5]C:R[-1]C) -> 0 | AS40: =SUM(R[-5]C:R[-1]C) -> 0 | AT40: =SUM(R[-5]C:R[-1]C) -> 10 | AU40: =SUM(R[-5]C:R[-1]C) -> 4 | AV40: =SUM(R[-5]C:R[-1]C) -> 2 | AW40: =SUM(R[-5]C:R[-1]C) -> 4 | AX40: =SUM(R[-5]C:R[-1]C) -> 4 | AY40: =SUM(R[-5]C:R[-1]C) -> 2 | AZ40: =SUM(R[-5]C:R[-1]C) -> 0 | BA40: =SUM(R[-5]C:R[-1]C) -> 2
B41: ІІ.2. Дисципліни вільного вибору студентів
B42: Професійна складова
B43: 15 | T43: Web-програмування на платформі NET | W43: Автоматизованих систем обробки інформації і управління | AE43: =RC[1]/30 -> 4 | AF43: =RC[1]+RC[5] -> 120 | AG43: =SUM(RC[1]:RC[3]) -> 72 | AH43: 36 | AJ43: 36 | AK43: =RC[-4]*2/3+IF(ISBLANK(RC[1]),0,30)+IF(ISBLANK(RC[4]),0,45)+IF(ISBLANK(RC[5]),0,30) -> 48 | AM43: 7д | AN43: 7 | AT43: =SUM(RC[1]:RC[3]) -> 4 | AU43: 2 | AW43: 2
B44: 16 | T44: Математичні методи оптимізації | W44: Автоматизованих систем обробки інформації і управління | AE44: =RC[1]/30 -> 3 | AF44: =RC[1]+RC[5] -> 90 | AG44: =SUM(RC[1]:RC[3]) -> 54 | AH44: 36 | AJ44: 18 | AK44: =RC[-4]*2/3+IF(ISBLANK(RC[1]),0,30)+IF(ISBLANK(RC[4]),0,45)+IF(ISBLANK(RC[5]),0,30) -> 36 | AM44: 8д | AN44: 8 | AX44: =SUM(RC[1]:RC[3]) -> 6 | AY44: 4 | BA44: 2
B45: Разом за цикл: | AE45: =SUM(R[-2]C:R[-1]C) -> 7 | AF45: =SUM(R[-2]C:R[-1]C) -> 210 | AG45: =SUM(R[-2]C:R[-1]C) -> 126 | AH45: =SUM(R[-2]C:R[-1]C) -> 72 | AI45: =SUM(R[-2]C:R[-1]C) -> 0 | AJ45: =SUM(R[-2]C:R[-1]C) -> 54 | AK45: =SUM(R[-2]C:R[-1]C) -> 84 | AL45: 0 | AM45: 2 | AN45: 2 | AO45: 0 | AP45: 0 | AQ45: 0 | AR45: 0 | AS45: 0 | AT45: =SUM(R[-2]C:R[-1]C) -> 4 | AU45: =SUM(R[-2]C:R[-1]C) -> 2 | AV45: =SUM(R[-2]C:R[-1]C) -> 0 | AW45: =SUM(R[-2]C:R[-1]C) -> 2 | AX45: =SUM(R[-2]C:R[-1]C) -> 6 | AY45: =SUM(R[-2]C:R[-1]C) -> 4 | AZ45: =SUM(R[-2]C:R[-1]C) -> 0 | BA45: =SUM(R[-2]C:R[-1]C) -> 2
T46: Всього за термін навчання: | AE46: =R[-24]C+R[-14]C+R[-6]C+R[-1]C -> 58.5 | AF46: =R[-24]C+R[-14]C+R[-6]C+R[-1]C -> 1755 | AG46: =R[-24]C+R[-14]C+R[-6]C+R[-1]C -> 720 | AH46: =R[-24]C+R[-14]C+R[-6]C+R[-1]C -> 352 | AI46: =R[-24]C+R[-14]C+R[-6]C+R[-1]C -> 62 | AJ46: =R[-24]C+R[-14]C+R[-6]C+R[-1]C -> 306 | AK46: =R[-24]C+R[-14]C+R[-6]C+R[-1]C -> 1035 | AL46: =R[-24]C+R[-14]C+R[-6]C+R[-1]C -> 4 | AM46: =R[-24]C+R[-14]C+R[-6]C+R[-1]C -> 10 | AN46: =R[-24]C+R[-14]C+R[-6]C+R[-1]C -> 10 | AO46: =R[-24]C+R[-14]C+R[-6]C+R[-1]C -> 1 | AP46: =R[-24]C+R[-14]C+R[-6]C+R[-1]C -> 0 | AQ46: =R[-24]C+R[-14]C+R[-6]C+R[-1]C -> 0 | AR46: =R[-24]C+R[-14]C+R[-6]C+R[-1]C -> 0 | AS46: =R[-24]C+R[-14]C+R[-6]C+R[-1]C -> 0 | AT46: =R[-24]C+R[-14]C+R[-6]C+R[-1]C -> 27 | AU46: =R[-24]C+R[-14]C+R[-6]C+R[-1]C -> 13 | AV46: =R[-24]C+R[-14]C+R[-6]C+R[-1]C -> 3 | AW46: =R[-24]C+R[-14]C+R[-6]C+R[-1]C -> 11 | AX46: =R[-24]C+R[-14]C+R[-6]C+R[-1]C -> 26 | AY46: =R[-24]C+R[-14]C+R[-6]C+R[-1]C -> 13 | AZ46: =R[-24]C+R[-14]C+R[-6]C+R[-1]C -> 1 | BA46: =R[-24]C+R[-14]C+R[-6]C+R[-1]C -> 12
AB47: Кількість | AE47: Екзаменів | AL47: 4 | AT47: 3 | AX47: 1
AE48: Заліків | AL48: 10 | AT48: 2+3д | AX48: 2+3д
AE49: Модульн. (темат.), контр. робіт | AL49: 10 | AT49: 6 | AX49: 4
T50: СКОРОЧЕННЯ: | AE50: Курсових проектів | AL50: 1 | AT50: 1
T51: РГР - розрахунково-графічна робота; | AE51: Курсових робіт
T52: РР - розрахункова робота; | AE52: РГР,РР,ГР
T53: ГР - графічна робота; | AE53: ДКР
T54: ДКР - домашня контрольна робота (виконується під час СРС) | AE54: Рефератів
B56: ПРАКТИКИ | AB56: АТЕСТАЦІЯ ВИПУСКНИКІВ
B57: № | T57: Вид практики | V57: Термін проведення | W57: Тривалість у тижнях | Y57: Семестр | AB57: № | AC57: Форма атестації випускників | AP57: Термін проведення
B58: 1 | T58: Переддипломна практика | V58: 03.04-07.05 2017 | W58: 5 | Y58: 8 | AB58: 1 | AC58: Захист дипломної роботи (проекту) ОКР - "бакалавр" | AP58: 19.06.2017 - 30.06.2017
T61: РОЗПОДІЛ ГОДИН ПО ПІДГОТОВЦІ ТА ЗАХИСТУ ДИПЛОМНОГО ПРОЕКТУ (РОБОТИ) РОЗПОДІЛ ГОДИН З КОМПЛЕКСНОГО ДЕРЖАВНОГО ЕКЗАМЕНУ
B63: Вид роботи | U63: Норма в годинах на 1 студента | V63: Кафедра | Y63: Кількість студентів | AA63: Всього годин | AE63: Вид роботи | AI63: Норма в годинах | AK63: К-ть дисциплін | AM63: Кафедра | AS63: Кількість груп | AU63: Кількість студентів | AW63: Всього годин
Y65: Б | Z65: К | AA65: Б | AB65: К | AS65: Б | AT65: К | AU65: Б | AV65: К | AW65: Б | AX65: К
B66: Керівництво | U66: 17 | V66: Автоматизованих систем обробки інформації і управління | Y66: 22 | Z66: 11 | AA66: =RC[-2]*RC[-6] -> 374 | AB66: =RC[-2]*RC[-7] -> 187 | AE66: Консультування дисциплін, що внесені в екзамен | AI66: 2 х Г
B69: Консультування | U69: 4 | V69: Автоматизованих систем обробки інформації і управління | Y69: 22 | Z69: 11 | AA69: =RC[-2]*RC[-6] -> 88 | AB69: =RC[-2]*RC[-7] -> 44
B70: Рецензування | U70: 2 | V70: Обчислювальної техніки | Y70: 22 | Z70: 11 | AA70: =RC[-2]*RC[-6] -> 44 | AB70: =RC[-2]*RC[-7] -> 22
AE71: усний екзамен | AI71: 0,5хd на 1 студ.
B72: ЕК | U72: 1,5 | V72: Автоматизованих систем обробки інформації і управління | Y72: 22 | Z72: 11 | AA72: =RC[-2]*RC[-6] -> 33 | AB72: =RC[-2]*RC[-7] -> 16.5
T73: Всього годин | U73: 24,5* | X73: Всього годин | AA73: =SUM(R[-7]C:R[-1]C) -> 539 | AB73: =SUM(R[-7]C:R[-1]C) -> 269.5 | AE73: письмовий екзамен | AI73: 4 х d х Г+0,5 на 1 студен.
AT75: Всього годин
AG76: Г - кількість академічних груп бюджетних або контрактних
U77: * - 0,5 годин голові ДЕК нараховується з централізованого погодинного фонду | AG77: d - кількість членів ДЕК з даної кафедри
U78: d - кількість членів ДЕК з даної кафедри
B80: 1. | T80: Фізичне виховання | AL80: 5 - 8 семестри - у формі секційних занять
B81: 2. | T81: Військова підготовка | AE81: 22.5 | AF81: 675 | AL81: У 5 - 8 семестрах за окремим планом військової підготовки.
AG83: Ухвалено на засіданні Вченої ради факультету, ПРОТОКОЛ № 8 від 28 березня 2016 р.
V86: В.о. завідувача кафедри | AA86: / Жданова О.Г. | AD86: / | AJ86: Декан факультету (директор інституту) | AQ86: / Павлов О.А. | AV86: /
Y87: (підпис) | AB87: (П.І.Б.) | AO87: (підпис) | AS87: (П.І.Б.)

Sheet: Маг 2 курс
B1: НАЦІОНАЛЬНИЙ ТЕХНІЧНИЙ УНІВЕРСИТЕТ УКРАЇНИ "КИЇВСЬКИЙ ПОЛІТЕХНІЧНИЙ ІНСТИТУТ"
B3: РОБОЧИЙ НАВЧАЛЬНИЙ ПЛАН
W4: на 2016/ 2017 навчальний рік
T5: ЗАТВЕРДЖУЮ | X5: (рік набору 2015 р.)
T6: Перший проректор НТУУ "КПІ" | W6: Напрям підготовки (код і назва) | AC6: - | AD6: 6.050103 Програмна інженерія | AR6: Факультет (інститут) | AW6: інформатики та обчислювальної техніки
W7: Спеціальність (код і назва) | AC7: - | AD7: 8.05010301 Програмне забезпечення систем | AR7: Форма навчання | AW7: денна
T8: _____________________________________Ю.І.Якименко | W8: Спеціалізація (назва) | AR8: Термін навчання | AW8: 1 рік 10 міс.
T9: "_____"____________ 2016 р. | W9: Освітньо-кваліфікаційний рівень | AC9: - | AD9: магістр | AR9: Кваліфікація | AW9: 2123 - професіонал в галузі
W10: Випускова кафедра | AC10: - | AD10: Автоматизованих систем обробки інформації та управління | AW10: програмування
B12: № п/п | T12: Найменування дисциплін | W12: Назва кафедр | AE12: Обсяг дисцип-ліни | AG12: Аудиторні години | AK12: Самостійна робота студентів | AL12: Контрольні заходи та їх розподіл за семестрами | AT12: Кількість годин аудиторних занять на тиждень за семестрами
AT13: II курс
AT14: ІП-51м (16Б+3К)
AE15: Кредитів | AF15: Годин | AG15: Всього | AH15: в тому числі | AL15: Екзамени | AM15: Заліки | AN15: Модульн.(темат.), контр.роботи | AO15: Курсові проекти | AP15: Курсові роботи | AQ15: РГР,РР,ГР | AR15: ДКР | AS15: Реферати | AT15: 3 семестр | AX15: 4 семестр
AH16: Лекції | AI16: Практичні (семінарські) | AJ16: Лабораторні (комп'ютерний практикум) | AT16: 18 тижнів | AX16: 18 тижнів
AT17: Всього | AU17: у тому числі | AX17: Всього | AY17: у тому числі
AU18: Лекції | AV18: Практичні | AW18: Лабора-торні | AY18: Лекції | AZ18: Практичні | BA18: Лабора-торні
B19: 1 | T19: 2 | W19: 3 | AE19: 4 | AF19: 5 | AG19: 6 | AH19: 7 | AI19: 8 | AJ19: 9 | AK19: 10 | AL19: 11 | AM19: 12 | AN19: 13 | AO19: 14 | AP19: 15 | AQ19: 16 | AR19: 17 | AS19: 18 | AT19: 19 | AU19: 20 | AV19: 21 | AW19: 22 | AX19: 23 | AY19: 24 | AZ19: 25 | BA19: 26
B20: 1.ОБОВ'ЯЗКОВІ НАВЧАЛЬНІ ДИСЦИПЛІНИ
B21: Професійної та практичної підготовки
B22: 1 | R22: Основи сталого розвитку суспільства | W22: Кібернетики хіміко-технологічних процесів | AE22: =RC[1]/30 -> 2 | AF22: =RC[1]+RC[5] -> 60 | AG22: =RC[1]+RC[2]+RC[3] -> 36 | AH22: 28 | AI22: 8 | AK22: 24 | AM22: 3 | AS22: 3 | AT22: 2 | AU22: 1.6 | AV22: 0.4
B23: 2 | R23: Патентознавство та авторське право | W23: Конструювання верстатів і машин | AE23: =RC[1]/30 -> 2 | AF23: =RC[1]+RC[5] -> 60 | AG23: =RC[1]+RC[2]+RC[3] -> 36 | AH23: 18 | AI23: 18 | AK23: 24 | AM23: 3 | AR23: 3 | AT23: 2 | AU23: 1 | AV23: 1
B24: 3 | R24: Високопродуктивні обчислення | W24: Обчислювальної техніки | AE24: =RC[1]/30 -> 5 | AF24: =RC[1]+RC[5] -> 150 | AG24: =RC[1]+RC[2]+RC[3] -> 72 | AH24: 36 | AJ24: 36 | AK24: 78 | AL24: 3 | AN24: 3 | AT24: 4 | AU24: 2 | AW24: 2
B25: 4 | R25: Високопродуктивні обчислення (курсова робота) | W25: Обчислювальної техніки | AE25: =RC[1]/30 -> 1 | AF25: =RC[1]+RC[5] -> 30 | AG25: 0 | AK25: 30 | AP25: 3
B26: Всього | AE26: =SUM(R[-4]C:R[-1]C) -> 10 | AF26: =SUM(R[-4]C:R[-1]C) -> 300 | AG26: =SUM(R[-4]C:R[-1]C) -> 144 | AH26: =SUM(R[-4]C:R[-1]C) -> 82 | AI26: =SUM(R[-4]C:R[-1]C) -> 26 | AJ26: =SUM(R[-4]C:R[-1]C) -> 36 | AK26: =SUM(R[-4]C:R[-1]C) -> 156 | AL26: 1 | AM26: 2 | AN26: 1 | AO26: 0 | AP26: 1 | AQ26: 0 | AR26: 1 | AS26: 1 | AT26: =SUM(R[-4]C:R[-1]C) -> 8 | AU26: =SUM(R[-4]C:R[-1]C) -> 4.5999999999999996 | AV26: =SUM(R[-4]C:R[-1]C) -> 1.4 | AW26: =SUM(R[-4]C:R[-1]C) -> 2 | AX26: =SUM(R[-4]C:R[-1]C) -> 0 | AY26: =SUM(R[-4]C:R[-1]C) -> 0 | AZ26: =SUM(R[-4]C:R[-1]C) -> 0 | BA26: =SUM(R[-4]C:R[-1]C) -> 0
B27: Наукова складова
B28: 5 | R28: Наукова робота за темою магістерської роботи - 2.Науково-дослідна робота за темою магістерської дисертації | W28: Автоматизованих систем обробки інформації і управління | AE28: =RC[1]/30 -> 5.5 | AF28: =RC[1]+RC[5] -> 165 | AG28: =RC[1]+RC[2]+RC[3] -> 18 | AI28: 18 | AK28: =180-33 -> 147 | AM28: 3
B29: 6 | R29: Науково-дослідна практика | W29: Автоматизованих систем обробки інформації і управління | AE29: =RC[1]/30 -> 6 | AF29: =RC[1]+RC[5] -> 180 | AG29: =RC[1]+RC[2]+RC[3] -> 0 | AK29: 180 | AM29: 4
B30: 7 | R30: Робота над магістерською дисертацією | W30: Автоматизованих систем обробки інформації і управління | AE30: =RC[1]/30 -> 22.5 | AF30: =RC[1]+RC[5] -> 675 | AG30: =RC[1]+RC[2]+RC[3] -> 0 | AK30: 675
B31: Разом за наукову складову | AE31: =SUM(R[-3]C:R[-1]C) -> 34 | AF31: =SUM(R[-3]C:R[-1]C) -> 1020 | AG31: =SUM(R[-3]C:R[-1]C) -> 18 | AH31: =SUM(R[-3]C:R[-1]C) -> 0 | AI31: =SUM(R[-3]C:R[-1]C) -> 18 | AJ31: =SUM(R[-3]C:R[-1]C) -> 0 | AK31: =SUM(R[-3]C:R[-1]C) -> 1002 | AL31: 0 | AM31: 2 | AN31: 0 | AO31: 0 | AP31: 0 | AQ31: 0 | AR31: 0 | AS31: 0 | AT31: =SUM(R[-3]C:R[-1]C) -> 0 | AU31: =SUM(R[-3]C:R[-1]C) -> 0 | AV31: =SUM(R[-3]C:R[-1]C) -> 0 | AW31: =SUM(R[-3]C:R[-1]C) -> 0 | AX31: 0 | AY31: 0 | AZ31: 0 | BA31: 0
B32: Всього обов'язкових | AE32: =R[-6]C+R[-1]C -> 44 | AF32: =R[-6]C+R[-1]C -> 1320 | AG32: =R[-6]C+R[-1]C -> 162 | AH32: =R[-6]C+R[-1]C -> 82 | AI32: =R[-6]C+R[-1]C -> 44 | AJ32: =R[-6]C+R[-1]C -> 36 | AK32: =R[-6]C+R[-1]C -> 1158 | AL32: =R[-6]C+R[-1]C -> 1 | AM32: =R[-6]C+R[-1]C -> 4 | AN32: =R[-6]C+R[-1]C -> 1 | AO32: =R[-6]C+R[-1]C -> 0 | AP32: =R[-6]C+R[-1]C -> 1 | AQ32: =R[-6]C+R[-1]C -> 0 | AR32: =R[-6]C+R[-1]C -> 1 | AS32: =R[-6]C+R[-1]C -> 1 | AT32: =R[-6]C+R[-1]C -> 8 | AU32: =R[-6]C+R[-1]C -> 4.5999999999999996 | AV32: =R[-6]C+R[-1]C -> 1.4 | AW32: =R[-6]C+R[-1]C -> 2 | AX32: =R[-6]C+R[-1]C -> 0 | AY32: =R[-6]C+R[-1]C -> 0 | AZ32: =R[-6]C+R[-1]C -> 0 | BA32: =R[-6]C+R[-1]C -> 0
B33: 2.ВИБІРКОВІ НАВЧАЛЬНІ ДИСЦИПЛІНИ
B34: Цикл гуманітарної та соціально-економічної підготовки
B35: 8 | R35: Іноземна мова професійного спрямування (поглиблено) -2. Іноземна мова для науковців-2 | W35: Англійської мови гуманітарного спрямування №3 | AE35: =RC[1]/30 -> 1.5 | AF35: =RC[1]+RC[5] -> 45 | AG35: =RC[1]+RC[2]+RC[3] -> 36 | AI35: 36 | AK35: =27-18 -> 9 | AM35: 3 | AT35: 2 | AV35: 2
B36: 9 | R36: Педагогіка | W36: Психології і педагогіки | AE36: =RC[1]/30 -> 1.5 | AF36: =RC[1]+RC[5] -> 45 | AG36: =RC[1]+RC[2]+RC[3] -> 28 | AH36: 24 | AI36: 4 | AK36: 17 | AM36: 3 | AT36: 1.5 | AU36: 1.3 | AV36: 0.2
B37: Разом за цикл: | AE37: =SUM(R[-2]C:R[-1]C) -> 3 | AF37: =SUM(R[-2]C:R[-1]C) -> 90 | AG37: =SUM(R[-2]C:R[-1]C) -> 64 | AH37: =SUM(R[-2]C:R[-1]C) -> 24 | AI37: =SUM(R[-2]C:R[-1]C) -> 40 | AJ37: =SUM(R[-2]C:R[-1]C) -> 0 | AK37: =SUM(R[-2]C:R[-1]C) -> 26 | AL37: 0 | AM37: 2 | AN37: 1 | AO37: 0 | AP37: 0 | AQ37: 0 | AR37: 0 | AS37: 0 | AT37: =SUM(R[-2]C:R[-1]C) -> 3.5 | AU37: =SUM(R[-2]C:R[-1]C) -> 1.3 | AV37: =SUM(R[-2]C:R[-1]C) -> 2.2000000000000002 | AW37: =SUM(R[-2]C:R[-1]C) -> 0 | AX37: =SUM(R[-2]C:R[-1]C) -> 0 | AY37: =SUM(R[-2]C:R[-1]C) -> 0 | AZ37: =SUM(R[-2]C:R[-1]C) -> 0 | BA37: =SUM(R[-2]C:R[-1]C) -> 0
B38: Цикл професійної та практичної підготовки
B39: 10 | R39: Моделі, технології проектування та управління інформаційними системами | W39: Автоматизованих систем обробки інформації і управління | AE39: =RC[1]/30 -> 5.5 | AF39: =RC[1]+RC[5] -> 165 | AG39: =RC[1]+RC[2]+RC[3] -> 90 | AH39: 36 | AJ39: 54 | AK39: 75 | AM39: 3Д | AN39: 3 | AT39: 5 | AU39: 2 | AW39: 3
B40: 11 | R40: Системний аналіз | W40: Автоматизованих систем обробки інформації і управління | AE40: =RC[1]/30 -> 6 | AF40: =RC[1]+RC[5] -> 180 | AG40: =RC[1]+RC[2]+RC[3] -> 90 | AH40: 54 | AJ40: 36 | AK40: 90 | AL40: 3 | AN40: 3 | AT40: 5 | AU40: 3 | AW40: 2
B41: Разом за цикл: | AE41: =SUM(R[-2]C:R[-1]C) -> 11.5 | AF41: =SUM(R[-2]C:R[-1]C) -> 345 | AG41: =SUM(R[-2]C:R[-1]C) -> 180 | AH41: =SUM(R[-2]C:R[-1]C) -> 90 | AI41: =SUM(R[-2]C:R[-1]C) -> 0 | AJ41: =SUM(R[-2]C:R[-1]C) -> 90 | AK41: =SUM(R[-2]C:R[-1]C) -> 165 | AL41: 1 | AM41: 1 | AN41: 2 | AO41: =SUM(R[-2]C:R[-1]C) -> 0 | AP41: 0 | AQ41: 0 | AR41: =SUM(R[-2]C:R[-1]C) -> 0 | AS41: =SUM(R[-2]C:R[-1]C) -> 0 | AT41: =SUM(R[-2]C:R[-1]C) -> 10 | AU41: =SUM(R[-2]C:R[-1]C) -> 5 | AV41: =SUM(R[-2]C:R[-1]C) -> 0 | AW41: =SUM(R[-2]C:R[-1]C) -> 5 | AX41: =SUM(R[-2]C:R[-1]C) -> 0 | AY41: =SUM(R[-2]C:R[-1]C) -> 0 | AZ41: =SUM(R[-2]C:R[-1]C) -> 0 | BA41: =SUM(R[-2]C:R[-1]C) -> 0
B42: Всього за вибором | AE42: =R[-1]C+R[-5]C -> 14.5 | AF42: =R[-1]C+R[-5]C -> 435 | AG42: =R[-1]C+R[-5]C -> 244 | AH42: =R[-1]C+R[-5]C -> 114 | AI42: =R[-1]C+R[-5]C -> 40 | AJ42: =R[-1]C+R[-5]C -> 90 | AK42: =R[-1]C+R[-5]C -> 191 | AL42: =R[-1]C+R[-5]C -> 1 | AM42: =R[-1]C+R[-5]C -> 3 | AN42: =R[-1]C+R[-5]C -> 3 | AO42: =R[-1]C+R[-5]C -> 0 | AP42: =R[-1]C+R[-5]C -> 0 | AQ42: =R[-1]C+R[-5]C -> 0 | AR42: =R[-1]C+R[-5]C -> 0 | AS42: =R[-1]C+R[-5]C -> 0 | AT42: =R[-1]C+R[-5]C -> 13.5 | AU42: =R[-1]C+R[-5]C -> 6.3 | AV42: =R[-1]C+R[-5]C -> 2.2000000000000002 | AW42: =R[-1]C+R[-5]C -> 5 | AX42: =R[-1]C+R[-5]C -> 0 | AY42: =R[-1]C+R[-5]C -> 0 | AZ42: =R[-1]C+R[-5]C -> 0 | BA42: =R[-1]C+R[-5]C -> 0
B43: Всього за термін навчання: | AE43: =R[-11]C+R[-1]C -> 58.5 | AF43: =R[-11]C+R[-1]C -> 1755 | AG43: =R[-11]C+R[-1]C -> 406 | AH43: =R[-11]C+R[-1]C -> 196 | AI43: =R[-11]C+R[-1]C -> 84 | AJ43: =R[-11]C+R[-1]C -> 126 | AK43: =R[-11]C+R[-1]C -> 1349 | AL43: =R[-11]C+R[-1]C -> 2 | AM43: =R[-11]C+R[-1]C -> 7 | AN43: =R[-11]C+R[-1]C -> 4 | AO43: =R[-11]C+R[-1]C -> 0 | AP43: =R[-11]C+R[-1]C -> 1 | AQ43: =R[-11]C+R[-1]C -> 0 | AR43: =R[-11]C+R[-1]C -> 1 | AS43: =R[-11]C+R[-1]C -> 1 | AT43: =R[-11]C+R[-1]C -> 21.5 | AU43: =R[-11]C+R[-1]C -> 10.899999999999999 | AV43: =R[-11]C+R[-1]C -> 3.6 | AW43: =R[-11]C+R[-1]C -> 7 | AX43: =R[-11]C+R[-1]C -> 0 | AY43: =R[-11]C+R[-1]C -> 0 | AZ43: =R[-11]C+R[-1]C -> 0 | BA43: =R[-11]C+R[-1]C -> 0
AB44: Кількість | AE44: Екзаменів | AL44: 2 | AT44: 2
AE45: Заліків | AL45: 7 | AT45: 5+1Д | AX45: 1
AE46: Модульн. (темат.), контр. робіт | AL46: 4 | AT46: 4
T47: СКОРОЧЕННЯ: | AE47: Курсових проектів | AL47: 0
T48: РГР - розрахунково-графічна робота; | AE48: Курсових робіт | AL48: 1 | AT48: 1
T49: РР - розрахункова робота; | AE49: РГР,РР,ГР | AL49: 0
T50: ГР - графічна робота; | AE50: ДКР | AL50: 1 | AT50: 1
T51: ДКР - домашня контрольна робота (виконується під час СРС) | AE51: Рефератів | AL51: 1 | AT51: 1
T55: РОЗПОДІЛ ГОДИН ПО ПІДГОТОВЦІ ТА ЗАХИСТУ ДИПЛОМНОГО ПРОЕКТУ (РОБОТИ) ПРАКТИКИ
B57: Вид роботи | U57: Норма в годинах на 1 студента | V57: Кафедра | Y57: Кількість студентів | AA57: Всього годин | AF57: № | AG57: Вид практики | AL57: Термін проведення | AT57: Тривалість у тижнях | AX57: Семестр
AF58: 1 | AG58: Науково-дослідна практика | AL58: 06.02 по 05.03.2017 | AT58: 4 | AX58: 4
Y59: Б | Z59: К | AA59: Б | AB59: К
B60: Керівництво | U60: 30 | V60: Автоматизованих систем обробки інформації і управління | Y60: 16 | Z60: 3 | AA60: =RC[-2]*RC[-6] -> 480 | AB60: =RC[-2]*RC[-7] -> 90
B63: Консультування | U63: 4 | V63: Автоматизованих систем обробки інформації і управління | Y63: 16 | Z63: 3 | AA63: =RC[-2]*RC[-6] -> 64 | AB63: =RC[-2]*RC[-7] -> 12 | AF63: АТЕСТАЦІЯ ВИПУСКНИКІВ
AF64: № | AG64: Форма атестації випускників | AT64: Термін проведення
B65: Рецензування | U65: 4 | V65: Обчислювальної техніки | Y65: 16 | Z65: 3 | AA65: =RC[-2]*RC[-6] -> 64 | AB65: =RC[-2]*RC[-7] -> 12 | AF65: 1 | AG65: Захист магістерської дисертації | AT65: 19.06 по 30.06.2017 р.
B68: ЕК | U68: 1,5 | V68: Автоматизованих систем обробки інформації і управління | Y68: 16 | Z68: 3 | AA68: =RC[-2]*RC[-6] -> 24 | AB68: =RC[-2]*RC[-7] -> 4.5
T69: Всього годин | U69: 39,5* | X69: Всього годин | AA69: =R[-9]C+R[-6]C+R[-4]C+R[-1]C -> 632 | AB69: =R[-9]C+R[-6]C+R[-4]C+R[-1]C -> 118.5
U71: * - 0,5 годин голові ДЕК нараховується з централізованого погодинного фонду
U72: d - кількість членів ДЕК з даної кафедри
AF73: Ухвалено на засіданні Вченої ради факультету, ПРОТОКОЛ № 8 від 28 березня 2016 р.
V76: В.о. завідувача кафедри | AA76: / Жданова О.Г. | AD76: / | AJ76: Декан факультету (директор інституту) | AQ76: / Павлов О.А. | AV76: /
Y77: (підпис) | AB77: (П.І.Б.) | AO77: (підпис) | AS77: (П.І.Б.)

Sheet: Спец 2 курс
B1: НАЦІОНАЛЬНИЙ ТЕХНІЧНИЙ УНІВЕРСИТЕТ УКРАЇНИ "КИЇВСЬКИЙ ПОЛІТЕХНІЧНИЙ ІНСТИТУТ"
B3: РОБОЧИЙ НАВЧАЛЬНИЙ ПЛАН
W4: на 2016/ 2017 навчальний рік
T5: ЗАТВЕРДЖУЮ | X5: (рік набору 2015 р.)
T6: Перший проректор НТУУ "КПІ" | W6: Напрям підготовки (код і назва) | AC6: - | AD6: 6.050103 Програмна інженерія | AR6: Факультет (інститут) | AW6: інформатики та обчислювальної техніки
W7: Спеціальність (код і назва) | AC7: - | AD7: 7.05010301 Програмне забезпечення систем | AR7: Форма навчання | AW7: денна
T8: _____________________________________Ю.І.Якименко | W8: Спеціалізація (назва) | AR8: Термін навчання | AW8: 1 рік 6 міс.
T9: "_____"____________ 2016 р. | W9: Освітньо-кваліфікаційний рівень | AC9: - | AD9: спеціаліст | AR9: Кваліфікація | AW9: 2131.2 - інженер з комп'ютерних
W10: Випускова кафедра | AC10: - | AD10: Автоматизованих систем обробки інформації та управління | AW10: систем
B12: № п/п | T12: Найменування дисциплін | W12: Назва кафедр | AE12: Обсяг дисцип-ліни | AG12: Аудиторні години | AK12: Самостійна робота студентів | AL12: Контрольні заходи та їх розподіл за семестрами | AT12: Кількість годин аудиторних занять на тиждень за семестрами
AT13: II курс
AT14: ІП-51с (16Б+0К)
AE15: Кредитів | AF15: Годин | AG15: Всього | AH15: в тому числі | AL15: Екзамени | AM15: Заліки | AN15: Модульн.(темат.), контр.роботи | AO15: Курсові проекти | AP15: Курсові роботи | AQ15: РГР,РР,ГР | AR15: ДКР | AS15: Реферати | AT15: 3 семестр | AX15: 4 семестр
AH16: Лекції | AI16: Практичні (семінарські) | AJ16: Лабораторні (комп'ютерний практикум) | AT16: 18 тижнів | AX16: 18 тижнів
AT17: Всього | AU17: у тому числі | AX17: Всього | AY17: у тому числі
AU18: Лекції | AV18: Практичні | AW18: Лабора-торні | AY18: Лекції | AZ18: Практичні | BA18: Лабора-торні
B19: 1 | T19: 2 | W19: 3 | AE19: 4 | AF19: 5 | AG19: 6 | AH19: 7 | AI19: 8 | AJ19: 9 | AK19: 10 | AL19: 11 | AM19: 12 | AN19: 13 | AO19: 14 | AP19: 15 | AQ19: 16 | AR19: 17 | AS19: 18 | AT19: 19 | AU19: 20 | AV19: 21 | AW19: 22 | AX19: 23 | AY19: 24 | AZ19: 25 | BA19: 26
B20: 1.ОБОВ'ЯЗКОВІ НАВЧАЛЬНІ ДИСЦИПЛІНИ
B21: Професійної та практичної підготовки
B22: 1 | R22: Переддипломна практика | W22: Автоматизованих систем обробки інформації і управління | AE22: =RC[1]/30 -> 12 | AF22: 360 | AM22: 3Д
B23: 2 | R23: Дипломне проектування | W23: Автоматизованих систем обробки інформації і управління | AE23: =RC[1]/30 -> 21 | AF23: 630
B26: Всього | AE26: =SUM(R[-4]C:R[-1]C) -> 33 | AF26: =SUM(R[-4]C:R[-1]C) -> 990 | AG26: =SUM(R[-4]C:R[-1]C) -> 0 | AH26: =SUM(R[-4]C:R[-1]C) -> 0 | AI26: =SUM(R[-4]C:R[-1]C) -> 0 | AJ26: =SUM(R[-4]C:R[-1]C) -> 0 | AK26: =SUM(R[-4]C:R[-1]C) -> 0 | AL26: 0 | AM26: 1 | AN26: 0 | AO26: 0 | AP26: 0 | AQ26: 0 | AR26: 0 | AS26: 0 | AT26: =SUM(R[-4]C:R[-1]C) -> 0 | AU26: =SUM(R[-4]C:R[-1]C) -> 0 | AV26: =SUM(R[-4]C:R[-1]C) -> 0 | AW26: =SUM(R[-4]C:R[-1]C) -> 0 | AX26: =SUM(R[-4]C:R[-1]C) -> 0 | AY26: =SUM(R[-4]C:R[-1]C) -> 0 | AZ26: =SUM(R[-4]C:R[-1]C) -> 0 | BA26: =SUM(R[-4]C:R[-1]C) -> 0
B27: 2.ВИБІРКОВІ НАВЧАЛЬНІ ДИСЦИПЛІНИ
B28: Цикл гуманітарної та соціально-економічної підготовки
B31: Разом за цикл: | AE31: =SUM(R[-2]C:R[-1]C) -> 0 | AF31: =SUM(R[-2]C:R[-1]C) -> 0 | AG31: =SUM(R[-2]C:R[-1]C) -> 0 | AH31: =SUM(R[-2]C:R[-1]C) -> 0 | AI31: =SUM(R[-2]C:R[-1]C) -> 0 | AJ31: =SUM(R[-2]C:R[-1]C) -> 0 | AK31: =SUM(R[-2]C:R[-1]C) -> 0 | AL31: 0 | AM31: 0 | AN31: 0 | AO31: 0 | AP31: 0 | AQ31: 0 | AR31: 0 | AS31: 0 | AT31: =SUM(R[-2]C:R[-1]C) -> 0 | AU31: =SUM(R[-2]C:R[-1]C) -> 0 | AV31: =SUM(R[-2]C:R[-1]C) -> 0 | AW31: =SUM(R[-2]C:R[-1]C) -> 0 | AX31: =SUM(R[-2]C:R[-1]C) -> 0 | AY31: =SUM(R[-2]C:R[-1]C) -> 0 | AZ31: =SUM(R[-2]C:R[-1]C) -> 0 | BA31: =SUM(R[-2]C:R[-1]C) -> 0
B32: Цикл професійної та практичної підготовки
B35: Разом за цикл: | AE35: =SUM(R[-2]C:R[-1]C) -> 0 | AF35: =SUM(R[-2]C:R[-1]C) -> 0 | AG35: =SUM(R[-2]C:R[-1]C) -> 0 | AH35: =SUM(R[-2]C:R[-1]C) -> 0 | AI35: =SUM(R[-2]C:R[-1]C) -> 0 | AJ35: =SUM(R[-2]C:R[-1]C) -> 0 | AK35: =SUM(R[-2]C:R[-1]C) -> 0 | AL35: 0 | AM35: 0 | AN35: 0 | AO35: =SUM(R[-2]C:R[-1]C) -> 0 | AP35: 0 | AQ35: 0 | AR35: =SUM(R[-2]C:R[-1]C) -> 0 | AS35: =SUM(R[-2]C:R[-1]C) -> 0 | AT35: =SUM(R[-2]C:R[-1]C) -> 0 | AU35: =SUM(R[-2]C:R[-1]C) -> 0 | AV35: =SUM(R[-2]C:R[-1]C) -> 0 | AW35: =SUM(R[-2]C:R[-1]C) -> 0 | AX35: =SUM(R[-2]C:R[-1]C) -> 0 | AY35: =SUM(R[-2]C:R[-1]C) -> 0 | AZ35: =SUM(R[-2]C:R[-1]C) -> 0 | BA35: =SUM(R[-2]C:R[-1]C) -> 0
B36: Всього за вибором | AE36: =R[-1]C+R[-5]C -> 0 | AF36: =R[-1]C+R[-5]C -> 0 | AG36: =R[-1]C+R[-5]C -> 0 | AH36: =R[-1]C+R[-5]C -> 0 | AI36: =R[-1]C+R[-5]C -> 0 | AJ36: =R[-1]C+R[-5]C -> 0 | AK36: =R[-1]C+R[-5]C -> 0 | AL36: =R[-1]C+R[-5]C -> 0 | AM36: =R[-1]C+R[-5]C -> 0 | AN36: =R[-1]C+R[-5]C -> 0 | AO36: =R[-1]C+R[-5]C -> 0 | AP36: =R[-1]C+R[-5]C -> 0 | AQ36: =R[-1]C+R[-5]C -> 0 | AR36: =R[-1]C+R[-5]C -> 0 | AS36: =R[-1]C+R[-5]C -> 0 | AT36: =R[-1]C+R[-5]C -> 0 | AU36: =R[-1]C+R[-5]C -> 0 | AV36: =R[-1]C+R[-5]C -> 0 | AW36: =R[-1]C+R[-5]C -> 0 | AX36: =R[-1]C+R[-5]C -> 0 | AY36: =R[-1]C+R[-5]C -> 0 | AZ36: =R[-1]C+R[-5]C -> 0 | BA36: =R[-1]C+R[-5]C -> 0
B37: Всього за термін навчання: | AE37: =R[-11]C+R[-1]C -> 33 | AF37: =R[-11]C+R[-1]C -> 990 | AG37: =R[-11]C+R[-1]C -> 0 | AH37: =R[-11]C+R[-1]C -> 0 | AI37: =R[-11]C+R[-1]C -> 0 | AJ37: =R[-11]C+R[-1]C -> 0 | AK37: =R[-11]C+R[-1]C -> 0 | AL37: =R[-11]C+R[-1]C -> 0 | AM37: =R[-11]C+R[-1]C -> 1 | AN37: =R[-11]C+R[-1]C -> 0 | AO37: =R[-11]C+R[-1]C -> 0 | AP37: =R[-11]C+R[-1]C -> 0 | AQ37: =R[-11]C+R[-1]C -> 0 | AR37: =R[-11]C+R[-1]C -> 0 | AS37: =R[-11]C+R[-1]C -> 0 | AT37: =R[-11]C+R[-1]C -> 0 | AU37: =R[-11]C+R[-1]C -> 0 | AV37: =R[-11]C+R[-1]C -> 0 | AW37: =R[-11]C+R[-1]C -> 0 | AX37: =R[-11]C+R[-1]C -> 0 | AY37: =R[-11]C+R[-1]C -> 0 | AZ37: =R[-11]C+R[-1]C -> 0 | BA37: =R[-11]C+R[-1]C -> 0
AB38: Кількість | AE38: Екзаменів | AL38: 0
AE39: Заліків | AL39: 1 | AT39: 1Д
AE40: Модульн. (темат.), контр. робіт
T41: СКОРОЧЕННЯ: | AE41: Курсових проектів
T42: РГР - розрахунково-графічна робота; | AE42: Курсових робіт
T43: РР - розрахункова робота; | AE43: РГР,РР,ГР
T44: ГР - графічна робота; | AE44: ДКР
T45: ДКР - домашня контрольна робота (виконується під час СРС) | AE45: Рефератів
T49: РОЗПОДІЛ ГОДИН ПО ПІДГОТОВЦІ ТА ЗАХИСТУ ДИПЛОМНОГО ПРОЕКТУ (РОБОТИ) ПРАКТИКИ
B51: Вид роботи | U51: Норма в годинах на 1 студента | V51: Кафедра | Y51: Кількість студентів | AA51: Всього годин | AF51: № | AG51: Вид практики | AL51: Термін проведення | AT51: Тривалість у тижнях | AX51: Семестр
AF52: 1 | AG52: Преддипломна практика | AL52: 01.09 по 23.10.2016 | AT52: 8 | AX52: 3
Y53: Б | Z53: К | AA53: Б | AB53: К
B54: Керівництво | U54: 21 | V54: Автоматизованих систем обробки інформації і управління | Y54: 16 | AA54: =RC[-2]*RC[-6] -> 336 | AB54: =RC[-2]*RC[-7] -> 0
B57: Консультування | U57: 4 | V57: Автоматизованих систем обробки інформації і управління | Y57: 16 | AA57: =RC[-2]*RC[-6] -> 64 | AB57: =RC[-2]*RC[-7] -> 0 | AF57: АТЕСТАЦІЯ ВИПУСКНИКІВ
AF58: № | AG58: Форма атестації випускників | AT58: Термін проведення
B59: Рецензування | U59: 3 | V59: Обчислювальної техніки | Y59: 16 | AA59: =RC[-2]*RC[-6] -> 48 | AB59: =RC[-2]*RC[-7] -> 0 | AF59: 1 | AG59: Захист дипломного проекту | AT59: 23.01 по 04.02.2017 р.
B62: ЕК | U62: 1,5 | V62: Автоматизованих систем обробки інформації і управління | Y62: 16 | AA62: =RC[-2]*RC[-6] -> 24 | AB62: =RC[-2]*RC[-7] -> 0
T63: Всього годин | U63: 29,5* | X63: Всього годин | AA63: =R[-9]C+R[-6]C+R[-4]C+R[-1]C -> 472 | AB63: =R[-9]C+R[-6]C+R[-4]C+R[-1]C -> 0
U65: * - 0,5 годин голові ДЕК нараховується з централізованого погодинного фонду
U66: d - кількість членів ДЕК з даної кафедри
AF67: Ухвалено на засіданні Вченої ради факультету, ПРОТОКОЛ № 8 від 28 березня 2016 р.
V70: В.о. завідувача кафедри | AA70: / Жданова О.Г. | AD70: / | AJ70: Декан факультету (директор інституту) | AQ70: / Павлов О.А. | AV70: /
Y71: (підпис) | AB71: (П.І.Б.) | AO71: (підпис) | AS71: (П.І.Б.)

Sheet: _old
B1: НАЦІОНАЛЬНИЙ ТЕХНІЧНИЙ УНІВЕРСИТЕТ УКРАЇНИ "КИЇВСЬКИЙ ПОЛІТЕХНІЧНИЙ ІНСТИТУТ"
B3: РОБОЧИЙ НАВЧАЛЬНИЙ ПЛАН
X4: на 2015/ 2016 навчальний рік | AV4: інформатики та
T5: ЗАТВЕРДЖУЮ | X5: (рік набору 2015 р.) | AQ5: Факультет (інститут) | AV5: обчислювальної техніки
T6: Перший проректор НТУУ "КПІ" | W6: Напрям підготовки (код і назва) | AC6: - | AD6: 6.050103 Програмна інженерія | AQ6: Форма навчання | AV6: денна
W7: Програма професійного спрямування | AD7: Програмне забезпечення систем | AQ7: Термін навчання | AV7: 3 роки 10 міс.
T8: .___________________________Ю.І.Якимено | W8: Освітньо-кваліфікаційний рівень | AD8: бакалавр | AQ8: Кваліфікація | AV8: 3121 фахівець з розробки та тестування
T9: "_____"_________________ 2015 р. | W9: Випускова кафедра | AC9: - | AD9: Автоматизованих систем обробки інформації та управління | AV9: програмного забезпечення
B11: № п/п | T11: Найменування дисциплін | W11: Назва кафедр | AE11: Обсяг дисципліни | AG11: Аудиторні години | AK11: Самостійна робота студентів | AL11: Контрольні заходи та їх розподіл за семестрами | AT11: Кількість годин аудиторних занять на тиждень за семестрами
AT12: I курс
AT13: ІП-51(23Б+10К), ІП-53(22Б+10К)
AE14: Кредитів | AF14: Годин | AG14: Всього | AH14: в тому числі | AL14: Екзамени | AM14: Заліки | AN14: Модульн.(темат.), контр.роботи | AO14: Курсові проекти | AP14: Курсові роботи | AQ14: РГР,РР,ГР | AR14: ДКР | AS14: Реферати | AT14: 1 семестр | AX14: 2 семестр
AH15: Лекції | AI15: Практичні (комп.прак. семінарські) | AJ15: Лабораторні | AT15: 18 тижнів | AX15: 18 тижнів
AT16: Всього | AU16: у тому числі | AX16: Всього | AY16: у тому числі
AU17: Лекції | AV17: Практичні | AW17: Лабора-торні | AY17: Лекції | AZ17: Практичні | BA17: Лабора-торні
B18: 1 | T18: 2 | W18: 3 | AE18: 4 | AF18: 5 | AG18: 6 | AH18: 7 | AI18: 8 | AJ18: 9 | AK18: 10 | AL18: 11 | AM18: 12 | AN18: 13 | AO18: 14 | AP18: 15 | AQ18: 16 | AR18: 17 | AS18: 18 | AT18: 19 | AU18: 20 | AV18: 21 | AW18: 22 | AX18: 23 | AY18: 24 | AZ18: 25 | BA18: 26
B19: ОБОВ'ЯЗКОВІ НАВЧАЛЬНІ ДИСЦИПЛІНИ
B20: Цикл природничо-наукової підготовки
B21: 1 | T21: Математичний аналіз-1. Диференціальні обчислення | W21: Математичного аналізу та теорії ймовірностей | AE21: =RC[1]/30 -> 5 | AF21: =RC[1]+RC[5] -> 150 | AG21: =RC[1]+RC[2]+RC[3] -> 90 | AH21: 54 | AI21: 36 | AK21: 60 | AL21: 1 | AN21: 1.1000000000000001 | AQ21: 1 | AT21: =RC[1]+RC[2]+RC[3] -> 5 | AU21: 3 | AV21: 2
B22: 2 | T22: Математичний аналіз-2. Інтегральні обчислення | W22: Математичного аналізу та теорії ймовірностей | AE22: =RC[1]/30 -> 5 | AF22: =RC[1]+RC[5] -> 150 | AG22: =RC[1]+RC[2]+RC[3] -> 90 | AH22: 36 | AI22: 54 | AK22: 60 | AL22: 2 | AN22: 2.2000000000000002 | AQ22: 2 | AX22: =RC[1]+RC[2]+RC[3] -> 5 | AY22: 2 | AZ22: 3
B23: 3 | T23: Лінійна алгебра та аналітична геометрія | W23: Математичного аналізу та теорії ймовірностей | AE23: =RC[1]/30 -> 3 | AF23: =RC[1]+RC[5] -> 90 | AG23: =RC[1]+RC[2]+RC[3] -> 72 | AH23: 36 | AI23: 36 | AK23: 18 | AM23: 1Д | AN23: 1 | AR23: 1 | AT23: =RC[1]+RC[2]+RC[3] -> 4 | AU23: 2 | AV23: 2
B24: 4 | T24: Дискретні структури | W24: Автоматизованих систем обробки інформації і управління | AE24: =RC[1]/30 -> 5 | AF24: =RC[1]+RC[5] -> 150 | AG24: =RC[1]+RC[2]+RC[3] -> 72 | AH24: 36 | AJ24: 36 | AK24: =RC[-4]*2/3+IF(ISBLANK(RC[1]),0,30)+IF(ISBLANK(RC[4]),0,45)+IF(ISBLANK(RC[5]),0,30) -> 78 | AL24: 2 | AN24: 2.2000000000000002 | AX24: =RC[1]+RC[2]+RC[3] -> 4 | AY24: 2 | BA24: 2
B25: 5 | T25: Фізика (вибрані розділи) | W25: Загальної і теоретичної фізики | AE25: =RC[1]/30 -> 4 | AF25: =RC[1]+RC[5] -> 120 | AG25: =RC[1]+RC[2]+RC[3] -> 72 | AH25: 36 | AI25: 18 | AJ25: 18 | AK25: =RC[-4]*2/3+IF(ISBLANK(RC[1]),0,30)+IF(ISBLANK(RC[4]),0,45)+IF(ISBLANK(RC[5]),0,30) -> 48 | AM25: 2 | AN25: 2 | AQ25: 2 | AX25: =RC[1]+RC[2]+RC[3] -> 4 | AY25: 2 | AZ25: 1 | BA25: 1
B26: Разом за цикл: | AE26: =SUM(R[-5]C:R[-1]C) -> 22 | AF26: =SUM(R[-5]C:R[-1]C) -> 660 | AG26: =SUM(R[-5]C:R[-1]C) -> 396 | AH26: =SUM(R[-5]C:R[-1]C) -> 198 | AI26: =SUM(R[-5]C:R[-1]C) -> 144 | AJ26: =SUM(R[-5]C:R[-1]C) -> 54 | AK26: =SUM(R[-5]C:R[-1]C) -> 264 | AL26: 3 | AM26: 2 | AN26: 8 | AO26: 0 | AP26: 0 | AQ26: 3 | AR26: 1 | AS26: 0 | AT26: =SUM(R[-5]C:R[-1]C) -> 9 | AU26: =SUM(R[-5]C:R[-1]C) -> 5 | AV26: =SUM(R[-5]C:R[-1]C) -> 4 | AW26: =SUM(R[-5]C:R[-1]C) -> 0 | AX26: =SUM(R[-5]C:R[-1]C) -> 13 | AY26: =SUM(R[-5]C:R[-1]C) -> 6 | AZ26: =SUM(R[-5]C:R[-1]C) -> 4 | BA26: =SUM(R[-5]C:R[-1]C) -> 3
B27: I.3. Цикл професійної та практичної підготовки
B28: 6 | T28: Комп'ютерна дискретна математика | W28: Автоматизованих систем обробки інформації і управління | AE28: =RC[1]/30 -> 7 | AF28: =RC[1]+RC[5] -> 210 | AG28: =RC[1]+RC[2]+RC[3] -> 108 | AH28: 72 | AI28: 36 | AK28: =RC[-4]*2/3+IF(ISBLANK(RC[1]),0,30)+IF(ISBLANK(RC[4]),0,45)+IF(ISBLANK(RC[5]),0,30) -> 102 | AL28: 1 | AN28: 1.1000000000000001 | AQ28: 1 | AT28: =RC[1]+RC[2]+RC[3] -> 6 | AU28: 4 | AV28: 2
B29: 7 | T29: Основи програмування - 1. Організація програм | W29: Автоматизованих систем обробки інформації і управління | AE29: =RC[1]/30 -> 6.5 | AF29: =RC[1]+RC[5] -> 195 | AG29: =RC[1]+RC[2]+RC[3] -> 90 | AH29: 54 | AJ29: 36 | AK29: 105 | AL29: 1 | AN29: 1.1000000000000001 | AT29: =RC[1]+RC[2]+RC[3] -> 5 | AU29: 3 | AW29: 2
B30: 8 | T30: Основи програмування - 2. Програмування структурованих даних | W30: Автоматизованих систем обробки інформації і управління | AE30: =RC[1]/30 -> 4 | AF30: =RC[1]+RC[5] -> 120 | AG30: =RC[1]+RC[2]+RC[3] -> 72 | AH30: 36 | AJ30: 36 | AK30: 48 | AM30: 2Д | AN30: 2.2000000000000002 | AX30: =RC[1]+RC[2]+RC[3] -> 4 | AY30: 2 | BA30: 2
B31: 9 | T31: Основи програмування - 2. Програмування структурованих даних (курсова робота) | W31: Автоматизованих систем обробки інформації і управління | AE31: =RC[1]/30 -> 1 | AF31: =RC[1]+RC[5] -> 30 | AG31: =RC[1]+RC[2]+RC[3] -> 0 | AK31: 30 | AP31: 2
B32: 10 | T32: Основи програмної інженерії | W32: Обчислювальної техніки | AE32: =RC[1]/30 -> 4 | AF32: =RC[1]+RC[5] -> 120 | AG32: =RC[1]+RC[2]+RC[3] -> 72 | AH32: 36 | AJ32: 36 | AK32: =RC[-4]*2/3+IF(ISBLANK(RC[1]),0,30)+IF(ISBLANK(RC[4]),0,45)+IF(ISBLANK(RC[5]),0,30) -> 48 | AM32: 2 | AN32: 2.2000000000000002 | AX32: =RC[1]+RC[2]+RC[3] -> 4 | AY32: 2 | BA32: 2
B33: 11 | T33: Алгоритми та структури даних | W33: Обчислювальної техніки | AE33: =RC[1]/30 -> 4 | AF33: =RC[1]+RC[5] -> 120 | AG33: =RC[1]+RC[2]+RC[3] -> 54 | AH33: 36 | AJ33: 18 | AK33: =RC[-4]*2/3+IF(ISBLANK(RC[1]),0,30)+IF(ISBLANK(RC[4]),0,45)+IF(ISBLANK(RC[5]),0,30) -> 66 | AL33: 2 | AN33: 2 | AX33: =RC[1]+RC[2]+RC[3] -> 3 | AY33: 2 | BA33: 1
B34: Разом за цикл: | AE34: =SUM(R[-6]C:R[-1]C) -> 26.5 | AF34: =SUM(R[-6]C:R[-1]C) -> 795 | AG34: =SUM(R[-6]C:R[-1]C) -> 396 | AH34: =SUM(R[-6]C:R[-1]C) -> 234 | AI34: =SUM(R[-6]C:R[-1]C) -> 36 | AJ34: =SUM(R[-6]C:R[-1]C) -> 126 | AK34: =SUM(R[-6]C:R[-1]C) -> 399 | AL34: 3 | AM34: 2 | AN34: 9 | AO34: 0 | AP34: 1 | AQ34: 1 | AR34: 0 | AS34: 0 | AT34: =SUM(R[-6]C:R[-1]C) -> 11 | AU34: =SUM(R[-6]C:R[-1]C) -> 7 | AV34: =SUM(R[-6]C:R[-1]C) -> 2 | AW34: =SUM(R[-6]C:R[-1]C) -> 2 | AX34: =SUM(R[-6]C:R[-1]C) -> 11 | AY34: =SUM(R[-6]C:R[-1]C) -> 6 | AZ34: =SUM(R[-6]C:R[-1]C) -> 0 | BA34: =SUM(R[-6]C:R[-1]C) -> 5
B35: Всього: | AE35: =R[-9]C+R[-1]C -> 48.5 | AF35: =R[-9]C+R[-1]C -> 1455 | AG35: =R[-9]C+R[-1]C -> 792 | AH35: =R[-9]C+R[-1]C -> 432 | AI35: =R[-9]C+R[-1]C -> 180 | AJ35: =R[-9]C+R[-1]C -> 180 | AK35: =R[-9]C+R[-1]C -> 663 | AL35: =R[-9]C+R[-1]C -> 6 | AM35: =R[-9]C+R[-1]C -> 4 | AN35: =R[-9]C+R[-1]C -> 17 | AO35: =R[-9]C+R[-1]C -> 0 | AP35: =R[-9]C+R[-1]C -> 1 | AQ35: =R[-9]C+R[-1]C -> 4 | AR35: =R[-9]C+R[-1]C -> 1 | AS35: =R[-9]C+R[-1]C -> 0 | AT35: =R[-9]C+R[-1]C -> 20 | AU35: =R[-9]C+R[-1]C -> 12 | AV35: =R[-9]C+R[-1]C -> 6 | AW35: =R[-9]C+R[-1]C -> 2 | AX35: =R[-9]C+R[-1]C -> 24 | AY35: =R[-9]C+R[-1]C -> 12 | AZ35: =R[-9]C+R[-1]C -> 4 | BA35: =R[-9]C+R[-1]C -> 8
B36: ВИБІРКОВІ НАВЧАЛЬНІ ДИСЦИПЛІН
B37: Цикл гуманітарної та соціально-економічної підготовки
B38: 12 | T38: Українська мова за професійним спрямуванням | W38: Української мови, літератури та культури | AE38: =RC[1]/30 -> 3 | AF38: =RC[1]+RC[5] -> 90 | AG38: =RC[1]+RC[2]+RC[3] -> 36 | AH38: 18 | AI38: 18 | AK38: 54 | AM38: 2Д | AX38: =RC[1]+RC[2]+RC[3] -> 2 | AY38: 1 | AZ38: 1
B39: 13 | T39: Історія України | W39: Історiї | AE39: =RC[1]/30 -> 3 | AF39: =RC[1]+RC[5] -> 90 | AG39: =RC[1]+RC[2]+RC[3] -> 36 | AH39: 18 | AI39: 18 | AK39: 54 | AM39: 1Д | AT39: =RC[1]+RC[2]+RC[3] -> 2 | AU39: 1 | AV39: 1
B40: 14 | T40: Іноземна мова-1. Вступ до загально – технічної іноземної мови | W40: Англійської мови гуманітарного спрямування № 3 | AE40: =RC[1]/30 -> 3 | AF40: =RC[1]+RC[5] -> 90 | AG40: =RC[1]+RC[2]+RC[3] -> 72 | AI40: 72 | AK40: 18 | AM40: 2 | AN40: 1 | AT40: =RC[1]+RC[2]+RC[3] -> 2 | AV40: 2 | AX40: =RC[1]+RC[2]+RC[3] -> 2 | AZ40: 2
T41: Разом за цикл: | AE41: =SUM(R[-3]C:R[-1]C) -> 9 | AF41: =SUM(R[-3]C:R[-1]C) -> 270 | AG41: =SUM(R[-3]C:R[-1]C) -> 144 | AH41: =SUM(R[-3]C:R[-1]C) -> 36 | AI41: =SUM(R[-3]C:R[-1]C) -> 108 | AJ41: =SUM(R[-3]C:R[-1]C) -> 0 | AK41: =SUM(R[-3]C:R[-1]C) -> 126 | AL41: 0 | AM41: 3 | AN41: 1 | AO41: 0 | AP41: 0 | AQ41: 0 | AR41: 0 | AS41: 0 | AT41: =SUM(R[-3]C:R[-1]C) -> 4 | AU41: =SUM(R[-3]C:R[-1]C) -> 1 | AV41: =SUM(R[-3]C:R[-1]C) -> 3 | AW41: =SUM(R[-3]C:R[-1]C) -> 0 | AX41: =SUM(R[-3]C:R[-1]C) -> 4 | AY41: =SUM(R[-3]C:R[-1]C) -> 1 | AZ41: =SUM(R[-3]C:R[-1]C) -> 3 | BA41: =SUM(R[-3]C:R[-1]C) -> 0
B42: Цикл професійної та практичної підготовки
B43: 15 | T43: Комп’ютерна логіка | W43: Обчислювальної техніки | AE43: =RC[1]/30 -> 4 | AF43: =RC[1]+RC[5] -> 120 | AG43: =RC[1]+RC[2]+RC[3] -> 72 | AH43: 36 | AI43: 36 | AK43: =RC[-4]*2/3+IF(ISBLANK(RC[1]),0,30)+IF(ISBLANK(RC[4]),0,45)+IF(ISBLANK(RC[5]),0,30) -> 48 | AM43: 1 | AN43: 1 | AT43: =RC[1]+RC[2]+RC[3] -> 4 | AU43: 2 | AV43: 2
B44: Разом за цикл: | AE44: =R[-1]C -> 4 | AF44: =R[-1]C -> 120 | AG44: =R[-1]C -> 72 | AH44: =R[-1]C -> 36 | AI44: =R[-1]C -> 36 | AJ44: =R[-1]C -> 0 | AK44: =R[-1]C -> 48 | AL44: =R[-1]C -> 0 | AM44: 1 | AN44: 1 | AO44: =R[-1]C -> 0 | AP44: =R[-1]C -> 0 | AQ44: =R[-1]C -> 0 | AR44: =R[-1]C -> 0 | AS44: =R[-1]C -> 0 | AT44: =R[-1]C -> 4 | AU44: =R[-1]C -> 2 | AV44: =R[-1]C -> 2 | AW44: =R[-1]C -> 0 | AX44: =R[-1]C -> 0 | AY44: =R[-1]C -> 0 | AZ44: =R[-1]C -> 0 | BA44: =R[-1]C -> 0
B45: Всього: | AE45: =R[-1]C+R[-4]C -> 13 | AF45: =R[-1]C+R[-4]C -> 390 | AG45: =R[-1]C+R[-4]C -> 216 | AH45: =R[-1]C+R[-4]C -> 72 | AI45: =R[-1]C+R[-4]C -> 144 | AJ45: =R[-1]C+R[-4]C -> 0 | AK45: =R[-1]C+R[-4]C -> 174 | AL45: =R[-1]C+R[-4]C -> 0 | AM45: =R[-1]C+R[-4]C -> 4 | AN45: =R[-1]C+R[-4]C -> 2 | AO45: =R[-1]C+R[-4]C -> 0 | AP45: =R[-1]C+R[-4]C -> 0 | AQ45: =R[-1]C+R[-4]C -> 0 | AR45: =R[-1]C+R[-4]C -> 0 | AS45: =R[-1]C+R[-4]C -> 0 | AT45: =R[-1]C+R[-4]C -> 8 | AU45: =R[-1]C+R[-4]C -> 3 | AV45: =R[-1]C+R[-4]C -> 5 | AW45: =R[-1]C+R[-4]C -> 0 | AX45: =R[-1]C+R[-4]C -> 4 | AY45: =R[-1]C+R[-4]C -> 1 | AZ45: =R[-1]C+R[-4]C -> 3 | BA45: =R[-1]C+R[-4]C -> 0
B46: Всього за термін навчання: | AE46: =R[-11]C+R[-1]C -> 61.5 | AF46: =R[-11]C+R[-1]C -> 1845 | AG46: =R[-11]C+R[-1]C -> 1008 | AH46: =R[-11]C+R[-1]C -> 504 | AI46: =R[-11]C+R[-1]C -> 324 | AJ46: =R[-11]C+R[-1]C -> 180 | AK46: =R[-11]C+R[-1]C -> 837 | AL46: =R[-11]C+R[-1]C -> 6 | AM46: =R[-11]C+R[-1]C -> 8 | AN46: =R[-11]C+R[-1]C -> 19 | AO46: =R[-11]C+R[-1]C -> 0 | AP46: =R[-11]C+R[-1]C -> 1 | AQ46: =R[-11]C+R[-1]C -> 4 | AR46: =R[-11]C+R[-1]C -> 1 | AS46: =R[-11]C+R[-1]C -> 0 | AT46: =R[-11]C+R[-1]C -> 28 | AU46: =R[-11]C+R[-1]C -> 15 | AV46: =R[-11]C+R[-1]C -> 11 | AW46: =R[-11]C+R[-1]C -> 2 | AX46: =R[-11]C+R[-1]C -> 28 | AY46: =R[-11]C+R[-1]C -> 13 | AZ46: =R[-11]C+R[-1]C -> 7 | BA46: =R[-11]C+R[-1]C -> 8
AB47: Кількість | AE47: Екзаменів | AL47: 6 | AT47: 3 | AX47: 3
AE48: Заліків | AL48: 8 | AT48: 1+2Д | AX48: 3+2Д
AE49: Модульн. (темат.), контр. робіт | AL49: 19 | AT49: 9 | AX49: 10
T50: СКОРОЧЕННЯ: | AE50: Курсових проектів | AL50: 0
T51: РГР - розрахунково-графічна робота; | AE51: Курсових робіт | AL51: 1 | AX51: 1
T52: РР - розрахункова робота; | AE52: РГР,РР,ГР | AL52: 4 | AT52: 2 | AX52: 2
T53: ГР - графічна робота; | AE53: ДКР | AL53: 1 | AT53: 1
T54: ДКР - домашня контрольна робота (виконується під час СРС) | AE54: Рефератів | AL54: 0
B56: ПРАКТИКИ | AB56: ДЕРЖАВНА АТЕСТАЦІЯ
B57: № | T57: Вид практики | V57: Термін проведення | W57: Тривалість у тижнях | Y57: Семестр | AB57: № | AC57: Форма державної атестації | AP57: Термін проведення
T61: РОЗПОДІЛ ГОДИН ПО ПІДГОТОВЦІ ТА ЗАХИСТУ ДИПЛОМНОГО ПРОЕКТУ (РОБОТИ) РОЗПОДІЛ ГОДИН З КОМПЛЕКСНОГО ДЕРЖАВНОГО ЕКЗАМЕНУ
B63: Вид роботи | U63: Норма в годинах на 1 студента | V63: Кафедра | Y63: Кількість студентів | AA63: Всього годин | AE63: Вид роботи | AI63: Норма в годинах | AK63: К-ть дисциплін | AM63: Кафедра | AS63: Кількість груп | AU63: Кількість студентів | AW63: Всього годин
Y65: Б | Z65: К | AA65: Б | AB65: К | AS65: Б | AT65: К | AU65: Б | AV65: К | AW65: Б | AX65: К
B66: Керівництво | AE66: Консультування дисциплін, що внесені в екзамен | AI66: 2 х Г
B69: Консультування
B71: Рецензування | U71: 2 | AE71: усний екзамен | AI71: 0,5хd на 1 студ.
AE73: письмовий екзамен | AI73: 4 х d х Г+0,5 на 1 студен.
B74: ДЕК | U74: 0,5 х d
T75: Всього годин | U75: 24,5* | X75: Всього годин | AA75: 0 | AB75: 0 | AT75: Всього годин
AG76: Г - кількість академічних груп бюджетних або контрактних
U77: * - 0,5 годин голові ДЕК нараховується з централізованого погодинного фонду | AG77: d - кількість членів ДЕК з даної кафедри
U78: d - кількість членів ДЕК з даної кафедри
B80: 1. | T80: Фізичне виховання | W80: Кафедра фізичного виховання | AG80: 144 | AH80: 4 | AI80: 140 | AK80: 36 | AM80: 2.4 | AT80: 4 | AU80: 0.1 | AV80: 3.9 | AX80: 4 | AY80: 0.1 | AZ80: 3.9
B82: 2. | T82: Військова підготовка | AE82: У 5 - 8 семестрах за окремим планом військової підготовки.
AF84: Ухвалено на засіданні Вченої ради факультету, ПРОТОКОЛ № 9 від 25 травня 2015 р.
V87: В.о. завідувача кафедри | AA87: / Жданова О.Г. | AD87: / | AJ87: Декан факультету (директор інституту) | AQ87: / Павлов О.А. | AV87: /
Y88: (підпис) | AB88: (П.І.Б.) | AO88: (підпис) | AS88: (П.І.Б.)

Sheet: 2 курс_old
B1: НАЦІОНАЛЬНИЙ ТЕХНІЧНИЙ УНІВЕРСИТЕТ УКРАЇНИ "КИЇВСЬКИЙ ПОЛІТЕХНІЧНИЙ ІНСТИТУТ"
B3: РОБОЧИЙ НАВЧАЛЬНИЙ ПЛАН
X4: на 2015/ 2016 навчальний рік | AV4: інформатики та
T5: ЗАТВЕРДЖУЮ | X5: (рік набору 2014 р.) | AQ5: Факультет (інститут) | AV5: обчислювальної техніки
T6: Перший проректор НТУУ "КПІ" | W6: Напрям підготовки (код і назва) | AC6: - | AD6: 6.050103 Програмна інженерія | AQ6: Форма навчання | AV6: денна
T7: _____________________________________Ю.І.Якименко | W7: Програма професійного спрямування | AC7: - | AD7: Програмне забезпечення систем | AQ7: Термін навчання | AV7: 3 роки 10 міс.
T8: "_____"_________________ 2015 р. | W8: Освітньо-кваліфікаційний рівень | AC8: - | AD8: бакалавр | AQ8: Кваліфікація | AV8: 3121 фахівець з розробки та тестування
W9: Випускова кафедра | AC9: - | AD9: Автоматизованих систем обробки інформації та управління | AV9: програмного забезпечення
B11: № п/п | T11: Найменування дисциплін | W11: Назва кафедр | AE11: Обсяг дисципліни | AG11: Аудиторні години | AK11: Самостійна робота студентів | AL11: Контрольні заходи та їх розподіл за семестрами | AT11: Кількість годин аудиторних занять на тиждень за семестрами
AT12: 2 курс
AT13: ІП-41(30Б+0К), ІП-43(1Б+23К)
AE14: Кредитів | AF14: Годин | AG14: Всього | AH14: в тому числі | AL14: Екзамени | AM14: Заліки | AN14: Модульн.(темат.), контр.роботи | AO14: Курсові проекти | AP14: Курсові роботи | AQ14: РГР,РР,ГР | AR14: ДКР | AS14: Реферати | AT14: 3 семестр | AX14: 4 семестр
AH15: Лекції | AI15: Практичні (семінарські) | AJ15: Лабораторні (комп'ютерний практикум) | AT15: 18 тижнів | AX15: 18 тижнів
AT16: Всього | AU16: у тому числі | AX16: Всього | AY16: у тому числі
AU17: Лекції | AV17: Практичні | AW17: Лабора-торні | AY17: Лекції | AZ17: Практичні | BA17: Лабора-торні
B18: 1 | T18: 2 | W18: 3 | AE18: 4 | AF18: 5 | AG18: 6 | AH18: 7 | AI18: 8 | AJ18: 9 | AK18: 10 | AL18: 11 | AM18: 12 | AN18: 13 | AO18: 14 | AP18: 15 | AQ18: 16 | AR18: 17 | AS18: 18 | AT18: 19 | AU18: 20 | AV18: 21 | AW18: 22 | AX18: 23 | AY18: 24 | AZ18: 25 | BA18: 26
B19: І. НОРМАТИВНІ НАВЧАЛЬНІ ДИСЦИПЛІНИ
B20: I.I. Цикл гуманітарної та соціально-економічної підготовки
B21: 1 | T21: Іноземна мова-2. Іноземна мова загальнотехнічного спрямування | W21: Англійської мови гуманітарного спрямування № 3 | AE21: =RC[1]/30 -> 3 | AF21: =SUM(RC[1]+RC[5]) -> 90 | AG21: =SUM(RC[1]:RC[3]) -> 72 | AI21: 72 | AK21: 18 | AL21: 4 | AN21: 3 | AT21: =SUM(RC[1]:RC[3]) -> 2 | AV21: 2 | AX21: =SUM(RC[1]:RC[3]) -> 2 | AZ21: 2
B22: 2 | T22: Філософія | W22: Філософії | AE22: =RC[1]/30 -> 3 | AF22: =SUM(RC[1]+RC[5]) -> 90 | AG22: =SUM(RC[1]:RC[3]) -> 54 | AH22: 36 | AI22: 18 | AK22: 36 | AL22: 3 | AT22: =SUM(RC[1]:RC[3]) -> 3 | AU22: 2 | AV22: 1
B23: Разом за цикл: | AE23: =SUM(R[-2]C:R[-1]C) -> 6 | AF23: =SUM(R[-2]C:R[-1]C) -> 180 | AG23: =SUM(R[-2]C:R[-1]C) -> 126 | AH23: =SUM(R[-2]C:R[-1]C) -> 36 | AI23: =SUM(R[-2]C:R[-1]C) -> 90 | AJ23: =SUM(R[-2]C:R[-1]C) -> 0 | AK23: =SUM(R[-2]C:R[-1]C) -> 54 | AL23: =COUNT(R[-2]C:R[-1]C) -> 2 | AM23: =COUNT(R[-2]C:R[-1]C) -> 0 | AN23: =COUNT(R[-2]C:R[-1]C) -> 1 | AO23: =COUNT(R[-2]C:R[-1]C) -> 0 | AP23: =SUM(R[-2]C:R[-1]C) -> 0 | AQ23: =SUM(R[-2]C:R[-1]C) -> 0 | AR23: =SUM(R[-2]C:R[-1]C) -> 0 | AS23: =SUM(R[-2]C:R[-1]C) -> 0 | AT23: =SUM(R[-2]C:R[-1]C) -> 5 | AU23: =SUM(R[-2]C:R[-1]C) -> 2 | AV23: =SUM(R[-2]C:R[-1]C) -> 3 | AW23: =SUM(R[-2]C:R[-1]C) -> 0 | AX23: =SUM(R[-2]C:R[-1]C) -> 2 | AY23: =SUM(R[-2]C:R[-1]C) -> 0 | AZ23: =SUM(R[-2]C:R[-1]C) -> 2 | BA23: =SUM(R[-2]C:R[-1]C) -> 0
B24: I.2. Цикл природничо-наукової підготовки
B25: 3 | T25: Фізика (вибрані розділи) | W25: Загальної і теоретичної фізики | AE25: =RC[1]/30 -> 4 | AF25: =SUM(RC[1]+RC[5]) -> 120 | AG25: =SUM(RC[1]:RC[3]) -> 72 | AH25: 36 | AI25: 18 | AJ25: 18 | AK25: 48 | AL25: 3 | AN25: 3 | AQ25: 3 | AT25: =SUM(RC[1]:RC[3]) -> 4 | AU25: 2 | AV25: 1 | AW25: 1
B26: 4 | T26: Теорія ймовірностей та математична статистика | W26: Автоматизованих систем обробки інформації і управління | AE26: =RC[1]/30 -> 3 | AF26: =SUM(RC[1]+RC[5]) -> 90 | AG26: =SUM(RC[1]:RC[3]) -> 54 | AH26: 36 | AI26: 18 | AK26: =RC[-4]*2/3+IF(ISBLANK(RC[1]),0,30)+IF(ISBLANK(RC[4]),0,45)+IF(ISBLANK(RC[5]),0,30) -> 36 | AM26: 3д | AN26: 3 | AT26: =SUM(RC[1]:RC[3]) -> 3 | AU26: 2 | AV26: 1
B27: Разом за цикл: | AE27: =SUM(R[-2]C:R[-1]C) -> 7 | AF27: =SUM(R[-2]C:R[-1]C) -> 210 | AG27: =SUM(R[-2]C:R[-1]C) -> 126 | AH27: =SUM(R[-2]C:R[-1]C) -> 72 | AI27: =SUM(R[-2]C:R[-1]C) -> 36 | AJ27: =SUM(R[-2]C:R[-1]C) -> 18 | AK27: =SUM(R[-2]C:R[-1]C) -> 84 | AL27: =COUNT(R[-2]C:R[-1]C) -> 1 | AM27: 1 | AN27: 2 | AO27: =SUM(R[-2]C:R[-1]C) -> 0 | AP27: =SUM(R[-2]C:R[-1]C) -> 0 | AQ27: =COUNT(R[-2]C:R[-1]C) -> 1 | AR27: =COUNT(R[-2]C:R[-1]C) -> 0 | AS27: =SUM(R[-2]C:R[-1]C) -> 0 | AT27: =SUM(R[-2]C:R[-1]C) -> 7 | AU27: =SUM(R[-2]C:R[-1]C) -> 4 | AV27: =SUM(R[-2]C:R[-1]C) -> 2 | AW27: =SUM(R[-2]C:R[-1]C) -> 1 | AX27: =SUM(R[-2]C:R[-1]C) -> 0 | AY27: =SUM(R[-2]C:R[-1]C) -> 0 | AZ27: =SUM(R[-2]C:R[-1]C) -> 0 | BA27: =SUM(R[-2]C:R[-1]C) -> 0
B28: Автоматизованих систем обробки інформації і управління
B29: 5 | T29: Об'єктно-орієнтоване програмування-1. Основи об'єктно-орієнтованого програмування | W29: Автоматизованих систем обробки інформації і управління | AE29: =RC[1]/30 -> 5 | AF29: =SUM(RC[1]+RC[5]) -> 150 | AG29: =SUM(RC[1]:RC[3]) -> 72 | AH29: 36 | AJ29: 36 | AK29: =RC[-4]*2/3+IF(ISBLANK(RC[1]),0,30)+IF(ISBLANK(RC[4]),0,45)+IF(ISBLANK(RC[5]),0,30) -> 78 | AL29: 3 | AN29: 3.3 | AT29: =SUM(RC[1]:RC[3]) -> 4 | AU29: 2 | AW29: 2
B30: 6 | T30: Об'єктно-орієнтоване програмування-2. Об'єктно-орієнтоване проектування на платформі Java | W30: Обчислювальної техніки | AE30: =RC[1]/30 -> 5 | AF30: =SUM(RC[1]+RC[5]) -> 150 | AG30: =SUM(RC[1]:RC[3]) -> 90 | AH30: 54 | AJ30: 36 | AK30: =RC[-4]*2/3+IF(ISBLANK(RC[1]),0,30)+IF(ISBLANK(RC[4]),0,45)+IF(ISBLANK(RC[5]),0,30) -> 60 | AM30: 4 | AN30: 4 | AX30: =SUM(RC[1]:RC[3]) -> 5 | AY30: 3 | BA30: 2
B31: 7 | T31: Об'єктно-орієнтоване програмування-2. Об'єктно-орієнтоване проектування на платформі Java (курсова робота) | W31: Обчислювальної техніки | AE31: =RC[1]/30 -> 1 | AF31: =SUM(RC[1]+RC[5]) -> 30 | AG31: =SUM(RC[1]:RC[3]) -> 0 | AK31: =RC[-4]*2/3+IF(ISBLANK(RC[1]),0,30)+IF(ISBLANK(RC[4]),0,45)+IF(ISBLANK(RC[5]),0,30) -> 30 | AP31: 4
B32: 8 | T32: Аналіз вимог до програмного забезпечення | W32: Автоматизованих систем обробки інформації і управління | AE32: =RC[1]/30 -> 3 | AF32: =SUM(RC[1]+RC[5]) -> 90 | AG32: =SUM(RC[1]:RC[3]) -> 54 | AH32: 36 | AJ32: 18 | AK32: =RC[-4]*2/3+IF(ISBLANK(RC[1]),0,30)+IF(ISBLANK(RC[4]),0,45)+IF(ISBLANK(RC[5]),0,30) -> 36 | AM32: 3 | AN32: 3 | AT32: =SUM(RC[1]:RC[3]) -> 3 | AU32: 2 | AW32: 1
B33: 9 | T33: Архітектура комп'ютера | W33: Обчислювальної техніки | AE33: =RC[1]/30 -> 4 | AF33: =SUM(RC[1]+RC[5]) -> 120 | AG33: =SUM(RC[1]:RC[3]) -> 72 | AH33: 36 | AJ33: 36 | AK33: =RC[-4]*2/3+IF(ISBLANK(RC[1]),0,30)+IF(ISBLANK(RC[4]),0,45)+IF(ISBLANK(RC[5]),0,30) -> 48 | AM33: 3д | AN33: 3 | AT33: =SUM(RC[1]:RC[3]) -> 4 | AU33: 2 | AW33: 2
B34: 10 | T34: Операційні системи | W34: Обчислювальної техніки | AE34: =RC[1]/30 -> 6 | AF34: =SUM(RC[1]+RC[5]) -> 180 | AG34: =SUM(RC[1]:RC[3]) -> 90 | AH34: 54 | AJ34: 36 | AK34: =RC[-4]*2/3+IF(ISBLANK(RC[1]),0,30)+IF(ISBLANK(RC[4]),0,45)+IF(ISBLANK(RC[5]),0,30) -> 90 | AL34: 4 | AN34: 4.4000000000000004 | AQ34: 4 | AX34: =SUM(RC[1]:RC[3]) -> 5 | AY34: 3 | BA34: 2
B35: 11 | T35: Архітектура та проектування програмного забезпечення | W35: Автоматизованих систем обробки інформації і управління | AE35: =RC[1]/30 -> 4 | AF35: =SUM(RC[1]+RC[5]) -> 120 | AG35: =SUM(RC[1]:RC[3]) -> 54 | AH35: 36 | AJ35: 18 | AK35: =RC[-4]*2/3+IF(ISBLANK(RC[1]),0,30)+IF(ISBLANK(RC[4]),0,45)+IF(ISBLANK(RC[5]),0,30) -> 66 | AL35: 4 | AN35: 4 | AX35: =SUM(RC[1]:RC[3]) -> 3 | AY35: 2 | BA35: 1
B36: 12 | T36: Бази даних 1 - Проектування баз даних | W36: Обчислювальної техніки | AE36: =RC[1]/30 -> 3 | AF36: =SUM(RC[1]+RC[5]) -> 90 | AG36: =SUM(RC[1]:RC[3]) -> 54 | AH36: 36 | AJ36: 18 | AK36: =RC[-4]*2/3+IF(ISBLANK(RC[1]),0,30)+IF(ISBLANK(RC[4]),0,45)+IF(ISBLANK(RC[5]),0,30) -> 36 | AM36: 4 | AN36: 4 | AX36: =SUM(RC[1]:RC[3]) -> 3 | AY36: 2 | BA36: 1
B37: 13 | T37: Емпіричні методи програмної інженерії | W37: Автоматизованих систем обробки інформації і управління | AE37: =RC[1]/30 -> 3 | AF37: =SUM(RC[1]+RC[5]) -> 90 | AG37: =SUM(RC[1]:RC[3]) -> 54 | AH37: 36 | AJ37: 18 | AK37: =RC[-4]*2/3+IF(ISBLANK(RC[1]),0,30)+IF(ISBLANK(RC[4]),0,45)+IF(ISBLANK(RC[5]),0,30) -> 36 | AM37: 4 | AN37: 4 | AX37: =SUM(RC[1]:RC[3]) -> 3 | AY37: 2 | BA37: 1
B38: Разом за цикл: | AE38: =SUM(R[-9]C:R[-1]C) -> 34 | AF38: =SUM(R[-9]C:R[-1]C) -> 1020 | AG38: =SUM(R[-9]C:R[-1]C) -> 540 | AH38: =SUM(R[-9]C:R[-1]C) -> 324 | AI38: =SUM(R[-9]C:R[-1]C) -> 0 | AJ38: =SUM(R[-9]C:R[-1]C) -> 216 | AK38: =SUM(R[-9]C:R[-1]C) -> 480 | AL38: =COUNT(R[-9]C:R[-1]C) -> 3 | AM38: 5 | AN38: 10 | AO38: =SUM(R[-5]C:R[-1]C) -> 0 | AP38: 1 | AQ38: =COUNT(R[-9]C:R[-1]C) -> 1 | AR38: =COUNT(R[-5]C:R[-1]C) -> 0 | AS38: =SUM(R[-5]C:R[-1]C) -> 0 | AT38: =SUM(R[-9]C:R[-1]C) -> 11 | AU38: =SUM(R[-9]C:R[-1]C) -> 6 | AV38: =SUM(R[-9]C:R[-1]C) -> 0 | AW38: =SUM(R[-9]C:R[-1]C) -> 5 | AX38: =SUM(R[-9]C:R[-1]C) -> 19 | AY38: =SUM(R[-9]C:R[-1]C) -> 12 | AZ38: =SUM(R[-9]C:R[-1]C) -> 0 | BA38: =SUM(R[-9]C:R[-1]C) -> 7
B39: ІІ. ВИБІРКОВІ НАВЧАЛЬНІ ДИСЦИПЛІНИ
B40: ІІ.1. Дисципліни самостійного вибору навчального закладу
B41: 14 | T41: Теорія алгоритмів | W41: Автоматизованих систем обробки інформації і управління | AE41: =RC[1]/30 -> 3.5 | AF41: =SUM(RC[1]+RC[5]) -> 105 | AG41: =SUM(RC[1]:RC[3]) -> 72 | AH41: 36 | AJ41: 36 | AK41: 33 | AM41: 3 | AN41: 3 | AT41: =SUM(RC[1]:RC[3]) -> 4 | AU41: 2 | AW41: 2
B42: 15 | T42: WEB-дизайн | W42: Автоматизованих систем обробки інформації і управління | AE42: =RC[1]/30 -> 3 | AF42: =SUM(RC[1]+RC[5]) -> 90 | AG42: =SUM(RC[1]:RC[3]) -> 54 | AH42: 36 | AJ42: 18 | AK42: 36 | AM42: 3 | AN42: 3 | AQ42: 3 | AT42: =SUM(RC[1]:RC[3]) -> 3 | AU42: 2 | AW42: 1
B43: 16 | T43: Програмування на платформі NET | W43: Автоматизованих систем обробки інформації і управління | AE43: =RC[1]/30 -> 4 | AF43: =RC[1]+RC[5] -> 120 | AG43: =SUM(RC[1]:RC[3]) -> 72 | AH43: 36 | AJ43: 36 | AK43: =RC[-4]*2/3+IF(ISBLANK(RC[1]),0,30)+IF(ISBLANK(RC[4]),0,45)+IF(ISBLANK(RC[5]),0,30) -> 48 | AM43: 4д | AN43: 4 | AQ43: 4 | AX43: =SUM(RC[1]:RC[3]) -> 4 | AY43: 2 | BA43: 2
B44: 17 | T44: Екологія | W44: Екології та технології рослинних полімерів | AE44: =RC[1]/30 -> 2 | AF44: =SUM(RC[1]+RC[5]) -> 60 | AG44: =SUM(RC[1]:RC[3]) -> 36 | AH44: 18 | AI44: 18 | AK44: =RC[-4]*2/3+IF(ISBLANK(RC[1]),0,30)+IF(ISBLANK(RC[4]),0,45)+IF(ISBLANK(RC[5]),0,30) -> 24 | AM44: 4д | AN44: 4 | AX44: =SUM(RC[1]:RC[3]) -> 2 | AY44: 1 | AZ44: 1
B45: Разом за цикл: | AE45: =SUM(R[-4]C:R[-1]C) -> 12.5 | AF45: =SUM(R[-4]C:R[-1]C) -> 375 | AG45: =SUM(R[-4]C:R[-1]C) -> 234 | AH45: =SUM(R[-4]C:R[-1]C) -> 126 | AI45: =SUM(R[-4]C:R[-1]C) -> 18 | AJ45: =SUM(R[-4]C:R[-1]C) -> 90 | AK45: =SUM(R[-4]C:R[-1]C) -> 141 | AL45: =COUNT(R[-4]C:R[-1]C) -> 0 | AM45: 4 | AN45: 4 | AO45: =SUM(R[-4]C:R[-1]C) -> 0 | AP45: =SUM(R[-4]C:R[-1]C) -> 0 | AQ45: =COUNT(R[-4]C:R[-1]C) -> 2 | AR45: =COUNT(R[-4]C:R[-1]C) -> 0 | AS45: =SUM(R[-4]C:R[-1]C) -> 0 | AT45: =SUM(R[-4]C:R[-1]C) -> 7 | AU45: =SUM(R[-4]C:R[-1]C) -> 4 | AV45: =SUM(R[-4]C:R[-1]C) -> 0 | AW45: =SUM(R[-4]C:R[-1]C) -> 3 | AX45: =SUM(R[-4]C:R[-1]C) -> 6 | AY45: =SUM(R[-4]C:R[-1]C) -> 3 | AZ45: =SUM(R[-4]C:R[-1]C) -> 1 | BA45: =SUM(R[-4]C:R[-1]C) -> 2
B46: ІІ.2. Дисципліни вільного вибору студентів
B47: Гуманітарна складова
B48: 18 | T48: Психологія | W48: Психології і педагогіки | AE48: 2 | AF48: 60 | AG48: 36 | AH48: 36 | AK48: 24 | AM48: 4 | AX48: =SUM(RC[1]:RC[3]) -> 2 | AY48: 2
B49: Разом за цикл: | AE49: =SUM(R[-1]C:R[-1]C) -> 2 | AF49: =SUM(R[-1]C:R[-1]C) -> 60 | AG49: =SUM(R[-1]C:R[-1]C) -> 36 | AH49: =SUM(R[-1]C:R[-1]C) -> 36 | AI49: =SUM(R[-1]C:R[-1]C) -> 0 | AJ49: =SUM(R[-1]C:R[-1]C) -> 0 | AK49: =SUM(R[-1]C:R[-1]C) -> 24 | AL49: 0 | AM49: 1 | AN49: 0 | AO49: 0 | AP49: 0 | AQ49: 0 | AR49: 0 | AS49: 0 | AT49: =SUM(R[-1]C:R[-1]C) -> 0 | AU49: =SUM(R[-1]C:R[-1]C) -> 0 | AV49: =SUM(R[-1]C:R[-1]C) -> 0 | AW49: =SUM(R[-1]C:R[-1]C) -> 0 | AX49: =SUM(R[-1]C:R[-1]C) -> 2 | AY49: =SUM(R[-1]C:R[-1]C) -> 2 | AZ49: =SUM(R[-1]C:R[-1]C) -> 0 | BA49: =SUM(R[-1]C:R[-1]C) -> 0
T50: Всього за термін навчання: | AE50: =R[-27]C+R[-23]C+R[-12]C+R[-5]C+R[-1]C -> 61.5 | AF50: =R[-27]C+R[-23]C+R[-12]C+R[-5]C+R[-1]C -> 1845 | AG50: =R[-27]C+R[-23]C+R[-12]C+R[-5]C+R[-1]C -> 1062 | AH50: =R[-27]C+R[-23]C+R[-12]C+R[-5]C+R[-1]C -> 594 | AI50: =R[-27]C+R[-23]C+R[-12]C+R[-5]C+R[-1]C -> 144 | AJ50: =R[-27]C+R[-23]C+R[-12]C+R[-5]C+R[-1]C -> 324 | AK50: =R[-27]C+R[-23]C+R[-12]C+R[-5]C+R[-1]C -> 783 | AL50: =R[-27]C+R[-23]C+R[-12]C+R[-5]C+R[-1]C -> 6 | AM50: =R[-27]C+R[-23]C+R[-12]C+R[-5]C+R[-1]C -> 11 | AN50: =R[-27]C+R[-23]C+R[-12]C+R[-5]C+R[-1]C -> 17 | AO50: =R[-27]C+R[-23]C+R[-12]C+R[-5]C+R[-1]C -> 0 | AP50: =R[-27]C+R[-23]C+R[-12]C+R[-5]C+R[-1]C -> 1 | AQ50: =R[-27]C+R[-23]C+R[-12]C+R[-5]C+R[-1]C -> 4 | AR50: =R[-27]C+R[-23]C+R[-12]C+R[-5]C+R[-1]C -> 0 | AS50: =R[-27]C+R[-23]C+R[-12]C+R[-5]C+R[-1]C -> 0 | AT50: =R[-27]C+R[-23]C+R[-12]C+R[-5]C+R[-1]C -> 30 | AU50: =R[-27]C+R[-23]C+R[-12]C+R[-5]C+R[-1]C -> 16 | AV50: =R[-27]C+R[-23]C+R[-12]C+R[-5]C+R[-1]C -> 5 | AW50: =R[-27]C+R[-23]C+R[-12]C+R[-5]C+R[-1]C -> 9 | AX50: =R[-27]C+R[-23]C+R[-12]C+R[-5]C+R[-1]C -> 29 | AY50: =R[-27]C+R[-23]C+R[-12]C+R[-5]C+R[-1]C -> 17 | AZ50: =R[-27]C+R[-23]C+R[-12]C+R[-5]C+R[-1]C -> 3 | BA50: =R[-27]C+R[-23]C+R[-12]C+R[-5]C+R[-1]C -> 9
AB51: Кількість | AE51: Екзаменів | AL51: 6 | AT51: 3 | AX51: 3
AE52: Заліків | AL52: 11 | AT52: 3+2д | AX52: 4+2д
AE53: Модульн. (темат.), контр. робіт | AL53: 17 | AT53: 9 | AX53: 8
T54: СКОРОЧЕННЯ: | AE54: Курсових проектів
T55: РГР - розрахунково-графічна робота; | AE55: Курсових робіт | AL55: 1 | AX55: 1
T56: РР - розрахункова робота; | AE56: РГР,РР,ГР | AL56: 4 | AT56: 2 | AX56: 2
T57: ГР - графічна робота; | AE57: ДКР
T58: ДКР - домашня контрольна робота (виконується під час СРС) | AE58: Рефератів
B60: ПРАКТИКИ | AB60: ДЕРЖАВНА АТЕСТАЦІЯ
B61: № | T61: Вид практики | V61: Термін проведення | W61: Тривалість у тижнях | Y61: Семестр | AB61: № | AC61: Форма державної атестації | AP61: Термін проведення
T65: РОЗПОДІЛ ГОДИН ПО ПІДГОТОВЦІ ТА ЗАХИСТУ ДИПЛОМНОГО ПРОЕКТУ (РОБОТИ) РОЗПОДІЛ ГОДИН З КОМПЛЕКСНОГО ДЕРЖАВНОГО ЕКЗАМЕНУ
B67: Вид роботи | U67: Норма в годинах на 1 студента | V67: Кафедра | Y67: Кількість студентів | AA67: Всього годин | AE67: Вид роботи | AI67: Норма в годинах | AK67: К-ть дисциплін | AM67: Кафедра | AS67: Кількість груп | AU67: Кількість студентів | AW67: Всього годин
Y69: Б | Z69: К | AA69: Б | AB69: К | AS69: Б | AT69: К | AU69: Б | AV69: К | AW69: Б | AX69: К
B70: Керівництво | AE70: Консультування дисциплін, що внесені в екзамен | AI70: 2 х Г
B73: Консультування
B75: Рецензування | U75: 2 | AE75: усний екзамен | AI75: 0,5хd на 1 студ.
AE77: письмовий екзамен | AI77: 4 х d х Г+0,5 на 1 студен.
B78: ДЕК | U78: 0,5 х d
T79: Всього годин | U79: 24,5* | X79: Всього годин | AA79: 0 | AB79: 0 | AT79: Всього годин
AG80: Г - кількість академічних груп бюджетних або контрактних
U81: * - 0,5 годин голові ДЕК нараховується з централізованого погодинного фонду | AG81: d - кількість членів ДЕК з даної кафедри
U82: d - кількість членів ДЕК з даної кафедри
B84: 1. | T84: Фізичне виховання | AE84: 6 | AF84: 180 | AG84: 144 | AH84: 4 | AI84: 140 | AK84: 36 | AM84: 3.4 | AT84: 4 | AU84: 0.1 | AV84: 3.9 | AX84: 4 | AY84: 0.1 | AZ84: 3.9
AL85: 5 - 8 семестри - у формі секційних занять
B86: 2. | T86: Військова підготовка | AE86: 19 | AF86: 570 | AL86: У 5 - 8 семестрах за окремим планом військової підготовки.
AG88: Ухвалено на засіданні Вченої ради факультету, ПРОТОКОЛ № 7 від 10 березня 2015 р.
V91: В.о. завідувача кафедри | AA91: / Жданова О.Г. | AD91: / | AJ91: Декан факультету (директор інституту) | AQ91: / Павлов О.А. | AV91: /
Y92: (підпис) | AB92: (П.І.Б.) | AO92: (підпис) | AS92: (П.І.Б.)

Sheet: Спец 1 курс_заоч_old
B1: НАЦІОНАЛЬНИЙ ТЕХНІЧНИЙ УНІВЕРСИТЕТ УКРАЇНИ "КИЇВСЬКИЙ ПОЛІТЕХНІЧНИЙ ІНСТИТУТ"
B3: РОБОЧИЙ НАВЧАЛЬНИЙ ПЛАН
W4: на 2015/ 2016 навчальний рік
T5: ЗАТВЕРДЖУЮ | X5: (рік набору 2015 р.)
T6: Перший проректор НТУУ "КПІ" | W6: Напрям підготовки (код і назва) | AC6: - | AD6: 6.050103 Програмна інженерія | AR6: Факультет (інститут) | AW6: інформатики та обчислювальної техніки
W7: Спеціальність (код і назва) | AC7: - | AD7: 7.05010301 Програмне забезпечення систем | AR7: Форма навчання | AW7: заочна
T8: _____________________________________Ю.І.Якименко | W8: Спеціалізація (назва) | AR8: Термін навчання | AW8: 1 рік 6 міс.
T9: "_____"____________ 2015 р. | W9: Освітньо-кваліфікаційний рівень | AC9: - | AD9: спеціаліст | AR9: Кваліфікація | AW9: 2131.2 - інженер з комп'ютерних
W10: Випускова кафедра | AC10: - | AD10: Автоматизованих систем обробки інформації та управління | AW10: систем
B12: № п/п | T12: Найменування дисциплін | W12: Назва кафедр | AE12: Обсяг дисцип-ліни | AG12: Аудиторні години | AK12: Самостійна робота студентів | AL12: Контрольні заходи та їх розподіл за семестрами | AT12: Кількість годин аудиторних занять на тиждень за семестрами
AT13: I курс
AT14: ІП-з53с (10Б+3К)
AE15: Кредитів | AF15: Годин | AG15: Всього | AH15: в тому числі | AL15: Екзамени | AM15: Заліки | AN15: Модульн.(темат.), контр.роботи | AO15: Курсові проекти | AP15: Курсові роботи | AQ15: РГР,РР,ГР | AR15: ДКР | AS15: Реферати | AT15: 1 семестр | AX15: 2 семестр
AH16: Лекції | AI16: Практичні (семінарські) | AJ16: Лабораторні (комп'ютерний практикум) | AT16: 18 тижнів | AX16: 18 тижнів
AT17: Всього | AU17: у тому числі | AX17: Всього | AY17: у тому числі
AU18: Лекції | AV18: Практичні | AW18: Лабора-торні | AY18: Лекції | AZ18: Практичні | BA18: Лабора-торні
B19: 1 | T19: 2 | W19: 3 | AE19: 4 | AF19: 5 | AG19: 6 | AH19: 7 | AI19: 8 | AJ19: 9 | AK19: 10 | AL19: 11 | AM19: 12 | AN19: 13 | AO19: 14 | AP19: 15 | AQ19: 16 | AR19: 17 | AS19: 18 | AT19: 19 | AU19: 20 | AV19: 21 | AW19: 22 | AX19: 23 | AY19: 24 | AZ19: 25 | BA19: 26
B20: 1.ОБОВ'ЯЗКОВІ НАВЧАЛЬНІ ДИСЦИПЛІНИ
B21: Професійної та практичної підготовки
B22: 1 | R22: Цивільний захист | W22: Охорони праці, промислової та цивільної безпеки | AE22: =RC[1]/30 -> 1 | AF22: =RC[1]+RC[5] -> 30 | AG22: =RC[1]+RC[2]+RC[3] -> 8 | AH22: 6 | AI22: 2 | AK22: 22 | AM22: 2Д | AS22: 2 | AX22: 8 | AY22: 6 | AZ22: 2
B23: 2 | R23: Охорона праці в галузі | W23: Охорони праці, промислової та цивільної безпеки | AE23: =RC[1]/30 -> 1 | AF23: =RC[1]+RC[5] -> 30 | AG23: =RC[1]+RC[2]+RC[3] -> 8 | AH23: 8 | AK23: 22 | AM23: 1Д | AT23: 8 | AU23: 8
B24: 3 | R24: Чинники успішного працевлаштування за фахом | W24: Автоматизованих систем обробки інформації і управління | AE24: =RC[1]/30 -> 1 | AF24: =RC[1]+RC[5] -> 30 | AG24: 4 | AH24: 4 | AK24: 26 | AM24: 2 | AX24: 4 | AY24: 4
B25: 4 | R25: Інтелектуальна власність | W25: Конструювання верстатів і машин | AE25: =RC[1]/30 -> 1 | AF25: =RC[1]+RC[5] -> 30 | AG25: 6 | AH25: 6 | AK25: 24 | AM25: 2 | AX25: 6 | AY25: 6
B26: 5 | R26: Дослідження операцій | W26: Автоматизованих систем обробки інформації і управління | AE26: =RC[1]/30 -> 4 | AF26: =RC[1]+RC[5] -> 120 | AG26: =RC[1]+RC[2]+RC[3] -> 18 | AH26: 10 | AI26: 4 | AJ26: 4 | AK26: 102 | AM26: 1 | AR26: 1 | AT26: 18 | AU26: 10 | AV26: 4 | AW26: 4
B27: 6 | R27: Мультимедійні технології | W27: Обчислювальної техніки | AE27: =RC[1]/30 -> 6 | AF27: =RC[1]+RC[5] -> 180 | AG27: =RC[1]+RC[2]+RC[3] -> 22 | AH27: 12 | AJ27: 10 | AK27: 158 | AL27: 1 | AR27: 1 | AT27: 22 | AU27: 12 | AW27: 10
B28: 7 | R28: Мультимедійні технології (курсова робота) | W28: Обчислювальної техніки | AE28: =RC[1]/30 -> 1 | AF28: =RC[1]+RC[5] -> 30 | AK28: 30 | AP28: 1
B29: 8 | R29: Математичне моделювання систем і процесів | W29: Автоматизованих систем обробки інформації і управління | AE29: =RC[1]/30 -> 6 | AF29: =RC[1]+RC[5] -> 180 | AG29: =RC[1]+RC[2]+RC[3] -> 20 | AH29: 12 | AJ29: 8 | AK29: 160 | AL29: 1 | AR29: 1 | AT29: 20 | AU29: 12 | AW29: 8
B30: 9 | R30: Моделі та алгоритми штучного інтелекту | W30: Автоматизованих систем обробки інформації і управління | AE30: =RC[1]/30 -> 6 | AF30: =RC[1]+RC[5] -> 180 | AG30: =RC[1]+RC[2]+RC[3] -> 22 | AH30: 12 | AJ30: 10 | AK30: 158 | AM30: 2Д | AR30: 2 | AX30: 22 | AY30: 12 | BA30: 10
B31: Всього обов'язкових | AE31: =SUM(R[-9]C:R[-1]C) -> 27 | AF31: =SUM(R[-9]C:R[-1]C) -> 810 | AG31: =SUM(R[-9]C:R[-1]C) -> 108 | AH31: =SUM(R[-9]C:R[-1]C) -> 70 | AI31: =SUM(R[-9]C:R[-1]C) -> 6 | AJ31: =SUM(R[-9]C:R[-1]C) -> 32 | AK31: =SUM(R[-9]C:R[-1]C) -> 702 | AL31: =SUM(R[-9]C:R[-1]C) -> 2 | AM31: 6 | AN31: 0 | AO31: =SUM(R[-9]C:R[-1]C) -> 0 | AP31: =SUM(R[-9]C:R[-1]C) -> 1 | AQ31: 0 | AR31: 4 | AS31: 1 | AT31: =SUM(R[-9]C:R[-1]C) -> 68 | AU31: =SUM(R[-9]C:R[-1]C) -> 42 | AV31: =SUM(R[-9]C:R[-1]C) -> 4 | AW31: =SUM(R[-9]C:R[-1]C) -> 22 | AX31: =SUM(R[-9]C:R[-1]C) -> 40 | AY31: =SUM(R[-9]C:R[-1]C) -> 28 | AZ31: =SUM(R[-9]C:R[-1]C) -> 2 | BA31: =SUM(R[-9]C:R[-1]C) -> 10
B32: 2.ВИБІРКОВІ НАВЧАЛЬНІ ДИСЦИПЛІНИ
B33: Цикл гуманітарної та соціально-економічної підготовки
B34: 10\ | R34: Іноземна мова професійного спрямування (поглиблено). | W34: Англійської мови технічного спрямування № 1 | AE34: =RC[1]/30 -> 3 | AF34: =RC[1]+RC[5] -> 90 | AG34: =RC[1]+RC[2]+RC[3] -> 12 | AI34: 12 | AK34: 78 | AM34: 1.2 | AR34: 1 | AT34: 6 | AV34: 6 | AX34: 6 | AZ34: 6
B35: Разом за цикл: | AE35: =SUM(R[-1]C:R[-1]C) -> 3 | AF35: =SUM(R[-1]C:R[-1]C) -> 90 | AG35: =SUM(R[-1]C:R[-1]C) -> 12 | AH35: =SUM(R[-1]C:R[-1]C) -> 0 | AI35: =SUM(R[-1]C:R[-1]C) -> 12 | AJ35: =SUM(R[-1]C:R[-1]C) -> 0 | AK35: =SUM(R[-1]C:R[-1]C) -> 78 | AL35: 0 | AM35: 2 | AN35: 0 | AO35: 0 | AP35: 0 | AQ35: 0 | AR35: 1 | AS35: 0 | AT35: =SUM(R[-1]C:R[-1]C) -> 6 | AU35: =SUM(R[-1]C:R[-1]C) -> 0 | AV35: =SUM(R[-1]C:R[-1]C) -> 6 | AW35: =SUM(R[-1]C:R[-1]C) -> 0 | AX35: =SUM(R[-1]C:R[-1]C) -> 6 | AY35: =SUM(R[-1]C:R[-1]C) -> 0 | AZ35: =SUM(R[-1]C:R[-1]C) -> 6 | BA35: =SUM(R[-1]C:R[-1]C) -> 0
B36: Цикл професійної та практичної підготовки
B37: 11 | R37: Технології прикладного програмування - 1. Технології створення ПП для мобільних платформ | W37: Автоматизованих систем обробки інформації і управління | AE37: =RC[1]/30 -> 4.5 | AF37: =RC[1]+RC[5] -> 135 | AG37: =RC[1]+RC[2]+RC[3] -> 20 | AH37: 10 | AJ37: 10 | AK37: 115 | AM37: 1Д | AR37: 1 | AT37: 20 | AU37: 10 | AW37: 10
B38: 12 | R38: Технології прикладного програмування - 2. Мережне програмне забезпечення | W38: Обчислювальної техніки | AE38: =RC[1]/30 -> 7 | AF38: =RC[1]+RC[5] -> 210 | AG38: =RC[1]+RC[2]+RC[3] -> 26 | AH38: 10 | AJ38: 16 | AK38: 184 | AL38: 2 | AR38: 2 | AX38: 26 | AY38: 10 | BA38: 16
B39: 13 | R39: Методи та системи підтримки прийняття рішень | W39: Автоматизованих систем обробки інформації і управління | AE39: =RC[1]/30 -> 6.5 | AF39: =RC[1]+RC[5] -> 195 | AG39: =RC[1]+RC[2]+RC[3] -> 24 | AH39: 10 | AI39: 4 | AJ39: 10 | AK39: 171 | AL39: 2 | AR39: 2 | AX39: 24 | AY39: 10 | AZ39: 4 | BA39: 10
B40: 14 | R40: Інтелектуальний аналіз даних | W40: Автоматизованих систем обробки інформації і управління | AE40: =RC[1]/30 -> 6 | AF40: =RC[1]+RC[5] -> 180 | AG40: =RC[1]+RC[2]+RC[3] -> 20 | AH40: 12 | AJ40: 8 | AK40: 160 | AL40: 1 | AR40: 1 | AT40: 20 | AU40: 12 | AW40: 8
B41: 15 | R41: Теорія компіляторів | W41: Автоматизованих систем обробки інформації і управління | AE41: =RC[1]/30 -> 6.5 | AF41: =RC[1]+RC[5] -> 195 | AG41: =RC[1]+RC[2]+RC[3] -> 18 | AH41: 8 | AJ41: 10 | AK41: 177 | AL41: 2 | AR41: 2 | AX41: 18 | AY41: 8 | BA41: 10
B42: 16 | R42: Теорія компіляторів (курсова робота) | W42: Автоматизованих систем обробки інформації і управління | AE42: =RC[1]/30 -> 1 | AF42: =RC[1]+RC[5] -> 30 | AK42: 30 | AP42: 2
B43: Разом за цикл: | AE43: =SUM(R[-6]C:R[-1]C) -> 31.5 | AF43: =SUM(R[-6]C:R[-1]C) -> 945 | AG43: =SUM(R[-6]C:R[-1]C) -> 108 | AH43: =SUM(R[-6]C:R[-1]C) -> 50 | AI43: =SUM(R[-6]C:R[-1]C) -> 4 | AJ43: =SUM(R[-6]C:R[-1]C) -> 54 | AK43: =SUM(R[-6]C:R[-1]C) -> 837 | AL43: 4 | AM43: 1 | AN43: 0 | AO43: =SUM(R[-6]C:R[-1]C) -> 0 | AP43: 1 | AQ43: 0 | AR43: 5 | AS43: =SUM(R[-6]C:R[-1]C) -> 0 | AT43: =SUM(R[-6]C:R[-1]C) -> 40 | AU43: =SUM(R[-6]C:R[-1]C) -> 22 | AV43: =SUM(R[-6]C:R[-1]C) -> 0 | AW43: =SUM(R[-6]C:R[-1]C) -> 18 | AX43: =SUM(R[-6]C:R[-1]C) -> 68 | AY43: =SUM(R[-6]C:R[-1]C) -> 28 | AZ43: =SUM(R[-6]C:R[-1]C) -> 4 | BA43: =SUM(R[-6]C:R[-1]C) -> 36
B44: Всього за вибором | AE44: =R[-1]C+R[-9]C -> 34.5 | AF44: =R[-1]C+R[-9]C -> 1035 | AG44: =R[-1]C+R[-9]C -> 120 | AH44: =R[-1]C+R[-9]C -> 50 | AI44: =R[-1]C+R[-9]C -> 16 | AJ44: =R[-1]C+R[-9]C -> 54 | AK44: =R[-1]C+R[-9]C -> 915 | AL44: =R[-1]C+R[-9]C -> 4 | AM44: =R[-1]C+R[-9]C -> 3 | AN44: =R[-1]C+R[-9]C -> 0 | AO44: =R[-1]C+R[-9]C -> 0 | AP44: =R[-1]C+R[-9]C -> 1 | AQ44: =R[-1]C+R[-9]C -> 0 | AR44: =R[-1]C+R[-9]C -> 6 | AS44: =R[-1]C+R[-9]C -> 0 | AT44: =R[-1]C+R[-9]C -> 46 | AU44: =R[-1]C+R[-9]C -> 22 | AV44: =R[-1]C+R[-9]C -> 6 | AW44: =R[-1]C+R[-9]C -> 18 | AX44: =R[-1]C+R[-9]C -> 74 | AY44: =R[-1]C+R[-9]C -> 28 | AZ44: =R[-1]C+R[-9]C -> 10 | BA44: =R[-1]C+R[-9]C -> 36
B45: Всього за термін навчання: | AE45: =R[-14]C+R[-1]C -> 61.5 | AF45: =R[-14]C+R[-1]C -> 1845 | AG45: =R[-14]C+R[-1]C -> 228 | AH45: =R[-14]C+R[-1]C -> 120 | AI45: =R[-14]C+R[-1]C -> 22 | AJ45: =R[-14]C+R[-1]C -> 86 | AK45: =R[-14]C+R[-1]C -> 1617 | AL45: =R[-14]C+R[-1]C -> 6 | AM45: =R[-14]C+R[-1]C -> 9 | AN45: =R[-14]C+R[-1]C -> 0 | AO45: =R[-14]C+R[-1]C -> 0 | AP45: =R[-14]C+R[-1]C -> 2 | AQ45: =R[-14]C+R[-1]C -> 0 | AR45: =R[-14]C+R[-1]C -> 10 | AS45: =R[-14]C+R[-1]C -> 1 | AT45: =R[-14]C+R[-1]C -> 114 | AU45: =R[-14]C+R[-1]C -> 64 | AV45: =R[-14]C+R[-1]C -> 10 | AW45: =R[-14]C+R[-1]C -> 40 | AX45: =R[-14]C+R[-1]C -> 114 | AY45: =R[-14]C+R[-1]C -> 56 | AZ45: =R[-14]C+R[-1]C -> 12 | BA45: =R[-14]C+R[-1]C -> 46
AB46: Кількість | AE46: Екзаменів | AL46: 6 | AT46: 3 | AX46: 3
AE47: Заліків | AL47: 9 | AT47: 2+2Д | AX47: 3+2Д
AE48: Модульн. (темат.), контр. робіт | AL48: 0
T49: СКОРОЧЕННЯ: | AE49: Курсових проектів | AL49: 0
T50: РГР - розрахунково-графічна робота; | AE50: Курсових робіт | AL50: 2 | AT50: 1 | AX50: 1
T51: РР - розрахункова робота; | AE51: РГР,РР,ГР | AL51: 0
T52: ГР - графічна робота; | AE52: ДКР | AL52: 10 | AT52: 6 | AX52: 4
T53: ДКР - домашня контрольна робота (виконується під час СРС) | AE53: Рефератів | AL53: 1 | AX53: 1
B56: ПРАКТИКИ | AB56: ДЕРЖАВНА АТЕСТАЦІЯ
B57: № | T57: Вид практики | V57: Термін проведення | W57: Тривалість у тижнях | Y57: Семестр | AB57: № | AC57: Форма державної атестації | AP57: Термін проведення
T61: РОЗПОДІЛ ГОДИН ПО ПІДГОТОВЦІ ТА ЗАХИСТУ ДИПЛОМНОГО ПРОЕКТУ (РОБОТИ) РОЗПОДІЛ ГОДИН З КОМПЛЕКСНОГО ДЕРЖАВНОГО ЕКЗАМЕНУ
B63: Вид роботи | U63: Норма в годинах на 1 студента | V63: Кафедра | Y63: Кількість студентів | AA63: Всього годин | AE63: Вид роботи | AI63: Норма в годинах | AK63: К-ть дисциплін | AM63: Кафедра | AS63: Кількість груп | AU63: Кількість студентів | AW63: Всього годин
Y65: Б | Z65: К | AA65: Б | AB65: К | AS65: Б | AT65: К | AU65: Б | AV65: К | AW65: Б | AX65: К
B66: Керівництво | AE66: Консультування дисциплін, що внесені в екзамен | AI66: 2 х Г
B69: Консультування
B71: Рецензування | U71: 4 | AE71: усний екзамен | AI71: 0,5хd на 1 студ.
AE73: письмовий екзамен | AI73: 4 х d х Г+0,5 на 1 студен.
B74: ДЕК | U74: 0,5 х d
T75: Всього годин | U75: 39,5* | X75: Всього годин | AA75: 0 | AB75: 0 | AT75: Всього годин
AG76: Г - кількість академічних груп бюджетних або контрактних
U77: * - 0,5 годин голові ДЕК нараховується з централізованого погодинного фонду | AG77: d - кількість членів ДЕК з даної кафедри
U78: d - кількість членів ДЕК з даної кафедри
AF79: Ухвалено на засіданні Вченої ради факультету, ПРОТОКОЛ № 9 від 25 травня 2015 р.
V82: В.о. завідувача кафедри | AA82: / Жданова О.Г. | AD82: / | AJ82: Декан факультету (директор інституту) | AQ82: / Павлов О.А. | AV82: /
Y83: (підпис) | AB83: (П.І.Б.) | AO83: (підпис) | AS83: (П.І.Б.)